img_link,tags,likes,comments,img_id,img_path
https://cdn.pixabay.com/photo/2022/04/04/08/43/road-7110643__340.jpg,"Road, Mountain, Countryside, Landscape",29,0,A00174,Imgs/A00174.jpg
https://cdn.pixabay.com/photo/2021/11/11/16/29/tree-6786654__340.jpg,"Tree, Leaves, Autumn, Season, Nature",89,21,A00175,Imgs/A00175.jpg
https://cdn.pixabay.com/photo/2022/03/23/17/41/fantasy-7087606__340.jpg,"Fantasy, Elf, Light, Plants, Bird Magic",32,17,A00176,Imgs/A00176.jpg
https://cdn.pixabay.com/photo/2022/03/12/09/27/couple-7063784__340.jpg,"Couple, Meadow, Walking, Nature, Sunset",17,5,A00177,Imgs/A00177.jpg
https://cdn.pixabay.com/photo/2016/12/16/15/25/christmas-1911637__340.jpg,"Christmas, Background, Flat Lay",2860,460,A00178,Imgs/A00178.jpg
https://cdn.pixabay.com/photo/2022/04/06/17/40/blackthorn-7116000__340.jpg,"Blackthorn, Sloe, Winter, Prunus Spinosa",23,20,A00179,Imgs/A00179.jpg
https://cdn.pixabay.com/photo/2021/08/27/19/55/boat-6579441__340.jpg,"Boat, River, Forest, Landscape, Woods",145,26,A00180,Imgs/A00180.jpg
https://cdn.pixabay.com/photo/2022/04/09/18/25/walnuts-7122043__340.jpg,"Walnuts, Nuts, Food, Healthy, Nutrition",11,5,A00181,Imgs/A00181.jpg
https://cdn.pixabay.com/photo/2022/04/12/04/46/climate-change-7127153__340.jpg,"Climate Change, Protest, People",12,9,A00182,Imgs/A00182.jpg
https://cdn.pixabay.com/photo/2021/08/08/15/45/mountains-6531264__340.jpg,"Mountains, Sunset, Germany, Fortress",116,26,A00183,Imgs/A00183.jpg
https://cdn.pixabay.com/photo/2021/11/27/18/28/candles-6828695__340.jpg,"Candles, Candlelight, Christmas",122,60,A00184,Imgs/A00184.jpg
https://cdn.pixabay.com/photo/2022/02/19/08/48/flower-7022112__340.jpg,"Flower, Butterfly, Fantasy, Spring",97,72,A00185,Imgs/A00185.jpg
https://cdn.pixabay.com/photo/2022/04/04/10/39/australian-wood-duck-7110865__340.jpg,"Australian Wood Duck, Duck, Bird",45,44,A00186,Imgs/A00186.jpg
https://cdn.pixabay.com/photo/2021/10/04/16/42/dog-6680642__340.jpg,"Dog, Puppy, Pet, Cute, Doggy, Animal",89,16,A00187,Imgs/A00187.jpg
https://cdn.pixabay.com/photo/2022/03/31/05/07/cherry-blossom-7102224__340.jpg,"Cherry Blossom, Spring, Nature, Flowers",57,48,A00188,Imgs/A00188.jpg
https://cdn.pixabay.com/photo/2021/12/26/19/36/christmas-tree-6895765__480.jpg,"Christmas Tree, Holiday, Season",54,11,A00189,Imgs/A00189.jpg
https://cdn.pixabay.com/photo/2021/07/26/22/04/sea-shell-6495338__340.jpg,"Sea Shell, Giant Conch",206,95,A00190,Imgs/A00190.jpg
https://cdn.pixabay.com/photo/2021/02/05/18/05/paper-5985445__340.jpg,"Paper, Crumpled, Texture, Shadows, Fold",186,38,A00191,Imgs/A00191.jpg
https://cdn.pixabay.com/photo/2022/03/31/14/16/bee-7103114__340.jpg,"Bee, Pollination, Entomology, Macro",57,41,A00192,Imgs/A00192.jpg
https://cdn.pixabay.com/photo/2022/04/06/05/26/butterfly-7114816__340.jpg,"Butterfly, Aurora Butterfly, Meadow",25,16,A00193,Imgs/A00193.jpg
https://cdn.pixabay.com/photo/2021/12/02/13/02/candles-6840499__340.jpg,4 Weihnachtskerzen,70,24,A00194,Imgs/A00194.jpg
https://cdn.pixabay.com/photo/2022/04/06/14/27/mute-swan-7115661__340.jpg,Add a description (optional),40,33,A00195,Imgs/A00195.jpg
https://cdn.pixabay.com/photo/2022/04/09/06/20/tulip-7120843__340.jpg,"Tulip, Spring, Flowering, Flower",9,2,A00196,Imgs/A00196.jpg
