img_link,tags,likes,comments,img_id,img_path
https://cdn.pixabay.com/photo/2022/04/10/17/55/birds-7123909__340.jpg,"Birds, Sea, Coast, Ships, Port, Travel",2,0,A00000338,Imgs/A00000338.jpg
https://cdn.pixabay.com/photo/2022/04/10/18/16/man-7123964__340.jpg,"Man, Kayak, Rowing, Boat, Water, Lake",10,3,A00000339,Imgs/A00000339.jpg
https://cdn.pixabay.com/photo/2022/04/10/09/55/bird-7123035__340.jpg,"Bird, Branch, Black, Woods, River",3,0,A00000340,Imgs/A00000340.jpg
https://cdn.pixabay.com/photo/2021/08/29/15/43/torrent-6583626__340.jpg,"Torrent, River, Forest, Water",109,58,A00000341,Imgs/A00000341.jpg
https://cdn.pixabay.com/photo/2021/02/02/15/23/rose-5974372__480.jpg,"Rose, Red, Smoke, Fog, Red Rose, Flower",370,51,A00000342,Imgs/A00000342.jpg
https://cdn.pixabay.com/photo/2019/11/10/11/13/couple-4615557__340.jpg,"Couple, Wedding, Marriage, Bridal",480,101,A00000343,Imgs/A00000343.jpg
https://cdn.pixabay.com/photo/2022/03/08/16/52/easter-eggs-7056166__340.jpg,"Easter Eggs, Design, Decoration",62,77,A00000344,Imgs/A00000344.jpg
https://cdn.pixabay.com/photo/2022/04/02/02/16/fox-7106138__340.jpg,"Fox, Planet, Fantasy, Animal, Nature",10,4,A00000345,Imgs/A00000345.jpg
https://cdn.pixabay.com/photo/2022/03/31/12/07/bulb-7102867__340.jpg,"Bulb, Butterfly, Light, Fire",15,16,A00000346,Imgs/A00000346.jpg
https://cdn.pixabay.com/photo/2021/10/11/12/49/boats-6700576__340.jpg,"Boats, Lake, Travel, Outdoors, Dusk",52,14,A00000347,Imgs/A00000347.jpg
https://cdn.pixabay.com/photo/2022/03/30/06/38/bird-7100599__340.jpg,"El bienteveo común​ o pitohué, también es conocido como bichofeo y pitogüé dependiendo de los paises. Su nombre científico es Pitangus sulphuratus. Es una especie de ave paseriforme perteneciente a la familia Tyrannidae. Se distribuye ampliamente en la República Argentina.",30,26,A00000348,Imgs/A00000348.jpg
https://cdn.pixabay.com/photo/2022/04/06/15/06/flower-7115709__340.jpg,"Flower, Hardy Fuchsia, Spring, Plant",16,28,A00000349,Imgs/A00000349.jpg
https://cdn.pixabay.com/photo/2022/04/11/04/54/frog-7124747__340.jpg,Frog is kicking the ladybug. Support me pls &lt;3,3,0,A00000350,Imgs/A00000350.jpg
https://cdn.pixabay.com/photo/2021/07/16/15/29/hellebore-6471156__340.jpg,"Hellebore, Flowers, Plant, Petals, Bloom",93,17,A00000351,Imgs/A00000351.jpg
https://cdn.pixabay.com/photo/2022/03/20/08/42/forsythia-7080263__340.jpg,"Forsythia, Forsythia Bush, Shrub",68,62,A00000352,Imgs/A00000352.jpg
https://cdn.pixabay.com/photo/2021/12/06/16/38/cedar-6850925__340.jpg,"Cedar, Branch, Winter, Evergreen, Tree",60,25,A00000353,Imgs/A00000353.jpg
https://cdn.pixabay.com/photo/2022/04/11/01/54/squirrel-7124532__340.jpg,"Squirrel, Chipmunk, Rodent, Mammal",3,0,A00000354,Imgs/A00000354.jpg
https://cdn.pixabay.com/photo/2022/04/09/21/47/animal-7122320__340.jpg,"Animal, Cat, Feline, Pet, Mammal, Fur",3,0,A00000355,Imgs/A00000355.jpg
https://cdn.pixabay.com/photo/2021/11/03/09/25/squirrel-6765124__340.jpg,"Squirrel, Animal, Wildlife, Nature",75,14,A00000356,Imgs/A00000356.jpg
https://cdn.pixabay.com/photo/2020/12/17/00/43/skyscrapers-5838029__340.jpg,"Skyscrapers, Buildings, Harbor, Skyline",304,57,A00000357,Imgs/A00000357.jpg
https://cdn.pixabay.com/photo/2017/12/11/15/34/lion-3012515__480.jpg,"Lion, Roar, Africa, Animal, Wildcat",1932,356,A00000358,Imgs/A00000358.jpg
https://cdn.pixabay.com/photo/2022/03/30/17/51/cormorant-7101604__340.jpg,"Cormorant, Bird, Flying, Nature, Animal",34,25,A00000359,Imgs/A00000359.jpg
https://cdn.pixabay.com/photo/2021/05/25/09/51/road-6281973__340.jpg,"Road, City, Motorcycle, Morning",68,0,A00000360,Imgs/A00000360.jpg
https://cdn.pixabay.com/photo/2022/04/07/15/23/gosling-7117722__340.jpg,"Gosling, Bird, Waterfowl, Chick",10,8,A00000361,Imgs/A00000361.jpg
https://cdn.pixabay.com/photo/2021/07/21/21/15/lavenders-6484003__340.jpg,Lavender Wonder,162,51,A00000362,Imgs/A00000362.jpg
https://cdn.pixabay.com/photo/2017/10/13/14/15/fantasy-2847724__340.jpg,"Fantasy, Spirit, Nightmare, Dream",1575,255,A00000363,Imgs/A00000363.jpg
https://cdn.pixabay.com/photo/2018/03/03/20/02/laptop-3196481__340.jpg,"Laptop, Office, Hand, Writing, Business",746,189,A00000364,Imgs/A00000364.jpg
https://cdn.pixabay.com/photo/2021/05/09/06/07/dog-6240043__340.jpg,"Dog, Puppy, Pet, Animal, Lonely",129,29,A00000365,Imgs/A00000365.jpg
https://cdn.pixabay.com/photo/2021/11/09/16/56/cat-6781934__340.jpg,"Cat, Pet, Feline, Animal, Fur, Kitty",58,14,A00000366,Imgs/A00000366.jpg
https://cdn.pixabay.com/photo/2022/04/09/15/26/flower-7121655__340.jpg,"Flower, Bud, Plant, Growth, Nature",7,3,A00000367,Imgs/A00000367.jpg
https://cdn.pixabay.com/photo/2022/03/06/19/19/hyacinth-7052370__340.jpg,"Hyacinth, Flower, Plant",88,75,A00000368,Imgs/A00000368.jpg
https://cdn.pixabay.com/photo/2021/08/06/23/26/lotus-6527384__340.jpg,"Lotus, Flower, Lotus Flower",100,38,A00000369,Imgs/A00000369.jpg
https://cdn.pixabay.com/photo/2022/04/01/08/37/tulip-7104352__340.jpg,Hier im Foto die Crispa Tulpe Lambada und der zweifleckige Zipfelkäfer auf Entdeckungstour!,33,32,A00000370,Imgs/A00000370.jpg
https://cdn.pixabay.com/photo/2022/04/06/08/21/bird-7115089__340.jpg,"Bird, Bill, Ornithology, Species, Fauna",13,8,A00000371,Imgs/A00000371.jpg
https://cdn.pixabay.com/photo/2022/04/04/07/03/guitar-7110499__340.jpg,"Guitar, Instrument, Music, Musician",28,18,A00000372,Imgs/A00000372.jpg
https://cdn.pixabay.com/photo/2022/04/11/11/55/cherry-blossoms-7125566__480.jpg,"Cherry Blossoms, Sakura, Pink Flowers",3,0,A00000373,Imgs/A00000373.jpg
https://cdn.pixabay.com/photo/2022/04/11/11/57/cherry-blossoms-7125570__340.jpg,"Cherry Blossoms, Sakura, Pink Flowers",2,0,A00000374,Imgs/A00000374.jpg
https://cdn.pixabay.com/photo/2022/04/12/22/03/bird-7129041__340.jpg,"Bird, Blackbird, Ornithology, Species",1,0,A00000375,Imgs/A00000375.jpg
https://cdn.pixabay.com/photo/2022/04/12/19/34/flower-7128725__340.jpg,"Flower, Crocus, Spring, Nature, Botany",0,0,A00000376,Imgs/A00000376.jpg
https://cdn.pixabay.com/photo/2022/04/06/17/07/flowers-7115956__340.jpg,"Flowers, Blossom, Branch, Spring",19,12,A00000377,Imgs/A00000377.jpg
https://cdn.pixabay.com/photo/2022/04/11/12/54/bird-7125671__340.jpg,"Bird, Dunnock, Blossom, Spring, Nature",3,0,A00000378,Imgs/A00000378.jpg
https://cdn.pixabay.com/photo/2022/04/09/22/23/glass-7122338__340.jpg,"Glass, Water Drop Art, Glass Art, Water",3,1,A00000379,Imgs/A00000379.jpg
https://cdn.pixabay.com/photo/2022/04/10/22/02/flowers-7124374__340.jpg,"Flowers, Arboretum, Blooms, Outdoors",2,1,A00000380,Imgs/A00000380.jpg
https://cdn.pixabay.com/photo/2022/04/11/16/55/crocus-7126222__340.jpg,"Crocus, Flower, Purple Flower",2,0,A00000381,Imgs/A00000381.jpg
https://cdn.pixabay.com/photo/2022/04/05/15/05/soap-bubble-7113815__340.jpg,"Soap Bubble, Close Up, Macro, Bubble",20,14,A00000382,Imgs/A00000382.jpg
https://cdn.pixabay.com/photo/2022/04/12/21/15/succulent-7128943__340.jpg,"Succulent, Botany, Growth, Plant, Macro",1,0,A00000383,Imgs/A00000383.jpg
https://cdn.pixabay.com/photo/2022/04/09/15/13/tomatoes-7121627__340.jpg,"Tomatoes, Fruit, Food, Vegetable, Basket",1,0,A00000384,Imgs/A00000384.jpg
https://cdn.pixabay.com/photo/2022/03/26/08/25/plum-blossom-7092491__340.jpg,"Plum Blossom, Blossom, Bloom, Plum Tree",51,36,A00000385,Imgs/A00000385.jpg
https://cdn.pixabay.com/photo/2022/04/11/14/29/flowers-7125904__340.jpg,"Flowers, Tulips, Garden, Nature, Spring",3,0,A00000386,Imgs/A00000386.jpg
https://cdn.pixabay.com/photo/2022/04/03/06/16/purple-flowers-7108115__340.jpg,"Purple Flowers, Flowers, Snow, Frost",20,13,A00000387,Imgs/A00000387.jpg
https://cdn.pixabay.com/photo/2020/12/03/12/35/sunset-5800386__340.jpg,"Sunset, Mountains, Lake, Silhouette",265,47,A00000388,Imgs/A00000388.jpg
https://cdn.pixabay.com/photo/2022/01/19/08/32/melons-6949139__480.jpg,"Melons, Yellow Melons, Fruits",27,8,A00000389,Imgs/A00000389.jpg
https://cdn.pixabay.com/photo/2020/10/01/11/07/hands-5618240__340.jpg,"Hands, Soil, Plant, Environment, Growth",140,42,A00000390,Imgs/A00000390.jpg
https://cdn.pixabay.com/photo/2017/09/25/13/12/cocker-spaniel-2785074__340.jpg,white and brown cockerspaniel,1401,197,A00000391,Imgs/A00000391.jpg
https://cdn.pixabay.com/photo/2021/09/15/15/55/winter-6627210__340.jpg,"Winter, Season, Glacier, Iceberg",97,16,A00000392,Imgs/A00000392.jpg
https://cdn.pixabay.com/photo/2022/04/03/16/14/daffodil-7109335__340.jpg,"Daffodil, Yellow Flower, Easter Bell",13,7,A00000393,Imgs/A00000393.jpg
https://cdn.pixabay.com/photo/2021/10/03/03/48/living-room-6676757__340.jpg,"Living Room, Interior Design, Indoors",25,12,A00000394,Imgs/A00000394.jpg
https://cdn.pixabay.com/photo/2022/04/09/10/11/bird-7121188__340.jpg,"Bird, Pelican, Ornithology, Beak, Avian",1,2,A00000395,Imgs/A00000395.jpg
https://cdn.pixabay.com/photo/2021/09/28/18/35/anemone-6665274__340.jpg,"Anemone, Flower, White Flower, Petals",123,110,A00000396,Imgs/A00000396.jpg
https://cdn.pixabay.com/photo/2022/04/09/16/26/bird-7121802__340.jpg,"Bird, Chestnut-Sided Warbler",1,0,A00000397,Imgs/A00000397.jpg
https://cdn.pixabay.com/photo/2022/04/05/20/57/walkway-7114426__340.jpg,Add a description (optional),20,16,A00000398,Imgs/A00000398.jpg
https://cdn.pixabay.com/photo/2022/04/09/18/22/rocky-coast-7122035__340.jpg,"Rocky Coast, Sea, Waterfall, Coast",1,0,A00000399,Imgs/A00000399.jpg
https://cdn.pixabay.com/photo/2017/06/17/18/35/background-2413081__340.jpg,"Background, Beach, Beautiful, Beauty",766,141,A00000400,Imgs/A00000400.jpg
https://cdn.pixabay.com/photo/2022/02/27/16/29/flag-7037591__340.jpg,"Flag, Landmark, Ukraine, Kiev, Europe",23,11,A00000401,Imgs/A00000401.jpg
https://cdn.pixabay.com/photo/2021/09/24/10/00/chick-6652163__340.jpg,"Chick, Chicken, Hand, Bird, Baby Chicken",104,32,A00000402,Imgs/A00000402.jpg
https://cdn.pixabay.com/photo/2022/04/11/08/08/river-7125068__340.jpg,"River, Trees, Forest, Mountains, Water",3,1,A00000403,Imgs/A00000403.jpg
https://cdn.pixabay.com/photo/2021/11/04/14/54/burning-candles-6768469__340.jpg,"Burning Candles, Candlestick, Night",55,31,A00000404,Imgs/A00000404.jpg
https://cdn.pixabay.com/photo/2021/09/09/21/04/fairy-lights-6611595__480.jpg,"Fairy Lights, Book, Cozy, Fairy Lights",68,13,A00000405,Imgs/A00000405.jpg
https://cdn.pixabay.com/photo/2022/04/04/07/33/architecture-7110562__340.jpg,"Architecture, Balcony, Statue, Facade",22,14,A00000406,Imgs/A00000406.jpg
https://cdn.pixabay.com/photo/2019/10/06/10/03/team-4529717__340.jpg,"Team, Friendship, Group, Hands",377,86,A00000407,Imgs/A00000407.jpg
https://cdn.pixabay.com/photo/2021/11/02/10/46/lemur-6762935__340.jpg,"Lemur, Animal, Wilderness, Nature",83,11,A00000408,Imgs/A00000408.jpg
https://cdn.pixabay.com/photo/2022/01/09/10/28/ferris-wheel-6925693__340.jpg,"Ferris Wheel, Amusement Park Ride",37,6,A00000409,Imgs/A00000409.jpg
https://cdn.pixabay.com/photo/2022/04/06/08/22/bird-7115092__340.jpg,"Bird, Bill, Ornithology, Species, Fauna",9,8,A00000410,Imgs/A00000410.jpg
https://cdn.pixabay.com/photo/2022/04/08/10/47/selva-di-cadore-7119264__340.jpg,"Selva Di Cadore, Village, Dolomites",3,2,A00000411,Imgs/A00000411.jpg
https://cdn.pixabay.com/photo/2022/03/28/20/17/sunset-7098273__340.jpg,"Sunset, Nature, Landscape, Sun, Trees",38,34,A00000412,Imgs/A00000412.jpg
https://cdn.pixabay.com/photo/2022/03/26/05/18/port-7092233__340.jpg,"Port, Thessaloniki, Greece, Cargo, Ship",52,46,A00000413,Imgs/A00000413.jpg
https://cdn.pixabay.com/photo/2021/12/28/15/19/fire-6899543__340.jpg,"Fire, Flame, Match, Burn, Smoke, Fire",42,8,A00000414,Imgs/A00000414.jpg
https://cdn.pixabay.com/photo/2022/04/04/01/21/hibiscus-7110145__340.jpg,"Hibiscus, Flower, Dewdrops, Raindrops",13,3,A00000415,Imgs/A00000415.jpg
https://cdn.pixabay.com/photo/2022/03/31/14/17/animal-7103116__340.jpg,"Animal, Squirrel, Eating, Species, Fauna",26,19,A00000416,Imgs/A00000416.jpg
https://cdn.pixabay.com/photo/2022/03/30/19/06/leaves-7101716__340.jpg,"Leaves, Red Leaves, Pink, Flora",22,30,A00000417,Imgs/A00000417.jpg
https://cdn.pixabay.com/photo/2022/04/12/15/57/pxclimateaction-7128270__340.jpg,"Pxclimateaction, Grain Field, Hand",8,6,A00000418,Imgs/A00000418.jpg
https://cdn.pixabay.com/photo/2022/04/09/10/25/bird-7121213__340.jpg,"Bird, Zebra Dove, Ornithology, Species",1,0,A00000419,Imgs/A00000419.jpg
https://cdn.pixabay.com/photo/2022/04/08/05/54/cat-7118740__480.jpg,"Cat, Kitten, Fur, Feline, Whiskers, Pet",7,7,A00000420,Imgs/A00000420.jpg
https://cdn.pixabay.com/photo/2022/04/04/17/58/blossom-7111984__340.jpg,"Blossom, Bloom, Snow Crystals",19,14,A00000421,Imgs/A00000421.jpg
https://cdn.pixabay.com/photo/2022/04/06/14/23/frangi-pani-7115653__340.jpg,"Frangi Pani, Plumerias, Flowers",7,10,A00000422,Imgs/A00000422.jpg
https://cdn.pixabay.com/photo/2022/03/19/11/23/pforphoto-7078346__340.jpg,Eingeparkt,49,38,A00000423,Imgs/A00000423.jpg
https://cdn.pixabay.com/photo/2022/03/29/17/26/chicken-7099837__340.jpg,"Chicken, Poultry, Farm Yard, Meadow",37,32,A00000424,Imgs/A00000424.jpg
https://cdn.pixabay.com/photo/2019/03/12/12/47/people-4050698__340.jpg,"People, Friends, Together, Happy, Kid",461,135,A00000425,Imgs/A00000425.jpg
https://cdn.pixabay.com/photo/2022/04/07/18/54/men-7118163__340.jpg,"Men, Beach, Sunset, Summer, Vacation",9,6,A00000426,Imgs/A00000426.jpg
https://cdn.pixabay.com/photo/2021/01/27/07/19/baby-5953965__340.jpg,"Baby, Read, Play, Reading, Playing, Toys",218,39,A00000427,Imgs/A00000427.jpg
https://cdn.pixabay.com/photo/2022/03/27/12/44/chongqing-7094942__340.jpg,"Chongqing, China, City, Hongyadong",4,0,A00000428,Imgs/A00000428.jpg
https://cdn.pixabay.com/photo/2022/01/19/05/28/flowers-6948806__340.jpg,"Flowers, Wildflowers, Meadow, Nature",48,18,A00000429,Imgs/A00000429.jpg
https://cdn.pixabay.com/photo/2021/08/21/07/55/croissant-6562091__340.jpg,"Croissant, Bread, Pastry, Breakfast",63,18,A00000430,Imgs/A00000430.jpg
https://cdn.pixabay.com/photo/2021/12/19/15/18/christmas-stars-6881348__340.jpg,"Christmas Stars, Cookies, Dough, Flour",72,59,A00000431,Imgs/A00000431.jpg
https://cdn.pixabay.com/photo/2022/02/21/21/18/animal-7027636__340.jpg,"Animal, Baby Mouse, Rodent, Mouse, Daisy",47,18,A00000432,Imgs/A00000432.jpg
https://cdn.pixabay.com/photo/2021/10/05/16/53/kimono-6683245__340.jpg,"Kimono, Costume, Shrine, Prayer, Worship",62,9,A00000433,Imgs/A00000433.jpg
https://cdn.pixabay.com/photo/2022/01/10/15/30/castle-6928593__340.jpg,"Castle, Fantasy, Night, Star, Historical",111,87,A00000434,Imgs/A00000434.jpg
https://cdn.pixabay.com/photo/2022/03/31/09/50/abstract-7102657__480.jpg,"Abstract, Arch, Background, Blue, Bright",7,0,A00000435,Imgs/A00000435.jpg
https://cdn.pixabay.com/photo/2021/10/25/08/55/nature-6740243__340.jpg,"Nature, Travel, Exploration, Adventure",58,7,A00000436,Imgs/A00000436.jpg
https://cdn.pixabay.com/photo/2022/04/09/15/13/pie-7121630__340.jpg,"Pie, Pastry, Food, Gourmet, Baked Goods",2,0,A00000437,Imgs/A00000437.jpg
https://cdn.pixabay.com/photo/2022/04/10/00/09/flower-7122467__340.jpg,"Flower, Plant, Shrub, Garden Flower",3,1,A00000438,Imgs/A00000438.jpg
https://cdn.pixabay.com/photo/2022/04/09/18/33/lily-7122062__340.jpg,"Lily, Flower, Plant, Lilac",2,0,A00000439,Imgs/A00000439.jpg
https://cdn.pixabay.com/photo/2022/04/05/16/10/flowers-7113979__340.jpg,"Flowers, Bouquet, Bloom, Blossom, Botany",17,6,A00000440,Imgs/A00000440.jpg
https://cdn.pixabay.com/photo/2022/04/02/08/24/helmetlings-7106530__340.jpg,"Helmetlings, Mushrooms, Forest, Nature",19,12,A00000441,Imgs/A00000441.jpg
https://cdn.pixabay.com/photo/2022/04/11/20/56/bird-7126616__340.jpg,"Bird, Goose, Grey Goose, Plumage, Beak",2,0,A00000442,Imgs/A00000442.jpg
https://cdn.pixabay.com/photo/2022/04/09/14/39/nature-7121561__340.jpg,"Nature, Landscape, Tree, Meadow, Field",2,0,A00000443,Imgs/A00000443.jpg
https://cdn.pixabay.com/photo/2022/04/12/10/37/bird-7127709__340.jpg,"Bird, Robin, Ornithology, Species, Fauna",0,0,A00000444,Imgs/A00000444.jpg
https://cdn.pixabay.com/photo/2022/04/11/08/43/forest-7125257__340.jpg,"Forest, Snow, Woods, Trees, Nature",1,0,A00000445,Imgs/A00000445.jpg
https://cdn.pixabay.com/photo/2022/02/04/13/44/chicken-6992752__340.jpg,"Chicken, Cock, Bird, Rooster, Poultry",84,73,A00000446,Imgs/A00000446.jpg
https://cdn.pixabay.com/photo/2021/08/04/10/21/lake-6521474__340.jpg,"Lake, Pathway, Field, Meadow, Tourists",68,10,A00000447,Imgs/A00000447.jpg
https://cdn.pixabay.com/photo/2022/04/09/21/02/church-7122275__340.jpg,"Church, Mountains, Landscape, Path",3,0,A00000448,Imgs/A00000448.jpg
https://cdn.pixabay.com/photo/2020/05/06/06/18/blue-5136251__340.jpg,"Blue, Sky, Fresh, Clean, Air, Cloud",218,46,A00000449,Imgs/A00000449.jpg
https://cdn.pixabay.com/photo/2021/11/17/16/55/office-6804135__340.jpg,"Office, Home Office, Interior Design",13,0,A00000450,Imgs/A00000450.jpg
https://cdn.pixabay.com/photo/2022/04/02/14/49/grill-7107159__480.jpg,"Grill, Bratwurst, Sausage, Barbeque",24,11,A00000451,Imgs/A00000451.jpg
https://cdn.pixabay.com/photo/2022/04/07/15/47/gosling-7117760__340.jpg,"Gosling, Bird, Waterfowl, Chick",7,4,A00000452,Imgs/A00000452.jpg
https://cdn.pixabay.com/photo/2022/04/06/18/45/flower-7116120__340.jpg,"Flower, Crocus, Insect, Spring, Violet",9,5,A00000453,Imgs/A00000453.jpg
https://cdn.pixabay.com/photo/2017/11/15/13/27/river-2951997__340.jpg,"River, Bach, Long Exposure, Atmospheric",837,145,A00000454,Imgs/A00000454.jpg
https://cdn.pixabay.com/photo/2022/01/02/08/47/animal-6909689__340.jpg,"Animal, Mammal, Wild Boar, Pig, Species",59,14,A00000455,Imgs/A00000455.jpg
https://cdn.pixabay.com/photo/2022/03/29/18/21/star-magnolia-7099920__340.jpg,"Star Magnolia, Magnolia, Magnolia Flower",34,34,A00000456,Imgs/A00000456.jpg
https://cdn.pixabay.com/photo/2022/03/30/06/54/daffodil-7100617__340.jpg,"Daffodil, Flower, Plant, Yellow Flower",26,8,A00000457,Imgs/A00000457.jpg
https://cdn.pixabay.com/photo/2017/11/07/00/07/fantasy-2925250__340.jpg,"Fantasy, Walker, Sculpture, Monument",2733,371,A00000458,Imgs/A00000458.jpg
https://cdn.pixabay.com/photo/2018/11/09/08/08/forest-3804001__340.jpg,"Forest, Woods, Autumn, Nature, Landscape",809,126,A00000459,Imgs/A00000459.jpg
https://cdn.pixabay.com/photo/2021/10/26/19/44/field-6745014__340.jpg,"Field, Tree, Tractor Tracks, Meadow",59,12,A00000460,Imgs/A00000460.jpg
https://cdn.pixabay.com/photo/2014/09/14/18/04/dandelion-445228__340.jpg,shallow focus photo of flowers,3087,699,A00000461,Imgs/A00000461.jpg
https://cdn.pixabay.com/photo/2021/06/29/18/55/mountain-slope-6374980__340.jpg,"Mountain Slope, Hill, Landscape",160,34,A00000462,Imgs/A00000462.jpg
https://cdn.pixabay.com/photo/2022/03/29/10/53/flowers-7099239__340.jpg,"Flowers, Hyacinths, Bloom, Blossom",41,61,A00000463,Imgs/A00000463.jpg
https://cdn.pixabay.com/photo/2019/10/19/16/30/poverty-4561704__480.jpg,grayscale photography of human holding coins,480,113,A00000464,Imgs/A00000464.jpg
https://cdn.pixabay.com/photo/2021/08/16/14/57/fountain-6550493__340.jpg,"Fountain, Splash, Flow, Water, Wet",62,16,A00000465,Imgs/A00000465.jpg
https://cdn.pixabay.com/photo/2022/03/24/19/57/bird-7089785__340.jpg,"Bird, Canada Goose, Ornithology, Species",45,41,A00000466,Imgs/A00000466.jpg
https://cdn.pixabay.com/photo/2022/03/27/11/22/great-tit-7094803__340.jpg,Add a description (optional),41,34,A00000467,Imgs/A00000467.jpg
https://cdn.pixabay.com/photo/2016/11/06/05/36/lake-1802337__340.jpg,"Lake, Sunset, Rocks, Bank, Conifers",1706,218,A00000468,Imgs/A00000468.jpg
https://cdn.pixabay.com/photo/2022/04/07/07/28/marguerite-7116998__340.jpg,"Marguerite, Flower, Yellow Flower",6,2,A00000469,Imgs/A00000469.jpg
https://cdn.pixabay.com/photo/2021/10/18/18/07/tree-6721755__340.jpg,Colorful Light Shines Through The Fog,53,19,A00000470,Imgs/A00000470.jpg
https://cdn.pixabay.com/photo/2022/03/29/03/40/food-7098703__340.jpg,"Food, Pizza, Italian Cuisine, Cook",7,0,A00000471,Imgs/A00000471.jpg
https://cdn.pixabay.com/photo/2021/11/20/10/40/nature-6811404__340.jpg,"Nature, Icicles, Snow, Winter, Season",55,0,A00000472,Imgs/A00000472.jpg
https://cdn.pixabay.com/photo/2022/04/09/01/11/common-heron-7120567__340.jpg,"Common Heron, Birds, Animal, Food, Hunt",2,2,A00000473,Imgs/A00000473.jpg
https://cdn.pixabay.com/photo/2021/12/13/21/43/drummer-6869168__340.jpg,"Drummer, Drums, Concert, Performance",27,8,A00000474,Imgs/A00000474.jpg
https://cdn.pixabay.com/photo/2022/03/30/20/16/hazelnut-7101787__340.jpg,"Hazelnut, Hazel, Hazel Tree, Buds",35,29,A00000475,Imgs/A00000475.jpg
https://cdn.pixabay.com/photo/2021/10/11/08/47/new-year-6699806__340.jpg,"New Year, New Beginnings, 2022",28,8,A00000476,Imgs/A00000476.jpg
https://cdn.pixabay.com/photo/2022/04/07/14/57/horse-7117688__340.jpg,"Horse, Brown Horse, Farm Animal, Equine",4,3,A00000477,Imgs/A00000477.jpg
https://cdn.pixabay.com/photo/2022/04/07/17/52/flower-7118075__480.jpg,"Flower, Red Flower, Nature, Spring",8,5,A00000478,Imgs/A00000478.jpg
https://cdn.pixabay.com/photo/2022/04/03/16/47/roses-7109418__340.jpg,"Roses, Bouquet, Flowers, Two-Tone Roses",10,4,A00000479,Imgs/A00000479.jpg
https://cdn.pixabay.com/photo/2022/04/06/17/15/flowers-7115966__340.jpg,"Flowers, Magnolia, Bloom, Blossom",3,0,A00000480,Imgs/A00000480.jpg
https://cdn.pixabay.com/photo/2022/04/08/00/25/plane-7118491__340.jpg,"Plane, Aviation, Show, Aircraft, Engine",3,0,A00000481,Imgs/A00000481.jpg
https://cdn.pixabay.com/photo/2021/09/16/21/15/bitcoin-6631099__340.jpg,"Bitcoin, Cryptocurrency, Blockchain",20,4,A00000482,Imgs/A00000482.jpg
https://cdn.pixabay.com/photo/2022/04/09/13/35/living-room-7121425__340.jpg,"Living Room, Sitting Room",0,0,A00000483,Imgs/A00000483.jpg
https://cdn.pixabay.com/photo/2022/03/23/06/37/bird-7086505__340.jpg,"Bird, Heron, Beak, Head, Feathers",38,32,A00000484,Imgs/A00000484.jpg
https://cdn.pixabay.com/photo/2022/04/06/17/35/flowers-7115991__340.jpg,"Flowers, Violet Flowers, Pansies, Garden",7,4,A00000485,Imgs/A00000485.jpg
https://cdn.pixabay.com/photo/2022/03/31/10/03/bumblebee-7102679__340.jpg,Aufgenommen am 27.3.2022,38,31,A00000486,Imgs/A00000486.jpg
https://cdn.pixabay.com/photo/2022/04/09/07/16/cat-7120927__340.jpg,"Cat, Black Cat, Pet, Feline, Animal",1,0,A00000487,Imgs/A00000487.jpg
https://cdn.pixabay.com/photo/2013/07/21/13/00/rose-165819__340.jpg,purple petal flower,2454,590,A00000488,Imgs/A00000488.jpg
https://cdn.pixabay.com/photo/2022/03/27/19/44/siberian-squill-7095979__340.jpg,"Siberian Squill, Flowers, Plant, Petals",36,38,A00000489,Imgs/A00000489.jpg
https://cdn.pixabay.com/photo/2017/11/29/09/15/paint-2985569__340.jpg,red yellow and white abstract painting,2061,264,A00000490,Imgs/A00000490.jpg
https://cdn.pixabay.com/photo/2022/02/20/11/40/kingfisher-7024395__340.jpg,"Kingfisher, Bird, Branch, Animal",86,72,A00000491,Imgs/A00000491.jpg
https://cdn.pixabay.com/photo/2018/05/12/17/41/forest-3394066__340.jpg,"Forest, Fog, Woods, Trees, Mystical",1162,193,A00000492,Imgs/A00000492.jpg
https://cdn.pixabay.com/photo/2022/04/08/23/46/flower-7120511__480.jpg,"Flower, Zinnia Elegan, Flora, Botany",5,2,A00000493,Imgs/A00000493.jpg
https://cdn.pixabay.com/photo/2022/01/02/13/05/fantasy-6910041__340.jpg,"Fantasy, Elf, Birds, Paradise",52,20,A00000494,Imgs/A00000494.jpg
https://cdn.pixabay.com/photo/2021/05/22/01/47/mountains-6272362__340.jpg,"Mountains, Snow, Peak, Summit",64,9,A00000495,Imgs/A00000495.jpg
https://cdn.pixabay.com/photo/2022/04/08/21/15/bird-7120308__340.jpg,"Bird, Coscoroba Swan, Ornithology",4,1,A00000496,Imgs/A00000496.jpg
https://cdn.pixabay.com/photo/2022/03/23/02/52/flower-7086315__340.jpg,"Flower, Crocus, Blossom, Bloom, Botany",52,44,A00000497,Imgs/A00000497.jpg
https://cdn.pixabay.com/photo/2018/11/06/14/01/couple-3798371__340.jpg,"Couple, Love, Outdoors, Pair, Park",1333,186,A00000498,Imgs/A00000498.jpg
https://cdn.pixabay.com/photo/2022/04/04/17/58/blossom-7111983__340.jpg,"Blossom, Bloom, Snow Crystals",17,10,A00000499,Imgs/A00000499.jpg
https://cdn.pixabay.com/photo/2021/05/30/13/06/lake-6295829__340.jpg,"Lake, Mountains, Snow, Water, Snowy",96,13,A00000500,Imgs/A00000500.jpg
https://cdn.pixabay.com/photo/2022/02/11/12/12/pforphoto-7007231__340.jpg,Wo ist Anfang wo ist Ende?,56,39,A00000501,Imgs/A00000501.jpg
https://cdn.pixabay.com/photo/2020/07/11/23/36/meeting-5395615__340.jpg,"Meeting, Workplace, Team, Office, Group",99,28,A00000502,Imgs/A00000502.jpg
https://cdn.pixabay.com/photo/2022/02/27/17/05/peace-7037652__340.jpg,&quot;All we are saying is give peace a chance.&quot; (John Lennon),46,35,A00000503,Imgs/A00000503.jpg
https://cdn.pixabay.com/photo/2022/04/09/19/04/daffodils-7122094__340.jpg,"Daffodils, Flowers, Plant",5,1,A00000504,Imgs/A00000504.jpg
https://cdn.pixabay.com/photo/2022/03/18/20/32/gerbera-7077394__340.jpg,"Gerbera, Daisy, Flowers, Orange Daisy",63,57,A00000505,Imgs/A00000505.jpg
https://cdn.pixabay.com/photo/2022/04/08/14/42/tulips-7119618__340.jpg,"Tulips, Flowers, Field, Spring",4,0,A00000506,Imgs/A00000506.jpg
https://cdn.pixabay.com/photo/2022/04/04/16/25/business-7111768__340.jpg,"Business, Handshake, Business Deal",1,0,A00000507,Imgs/A00000507.jpg
https://cdn.pixabay.com/photo/2022/04/10/16/34/bird-7123763__480.jpg,"Bird, Crane, Water, Everglades",2,2,A00000508,Imgs/A00000508.jpg
https://cdn.pixabay.com/photo/2020/08/09/11/31/business-5475283__340.jpg,"Business, Bar, Restaurant, Shield",140,31,A00000509,Imgs/A00000509.jpg
https://cdn.pixabay.com/photo/2022/04/11/06/25/canoe-7124906__340.jpg,"Canoe, Sunset, Beach, Sea, Ocean",1,0,A00000510,Imgs/A00000510.jpg
https://cdn.pixabay.com/photo/2021/08/23/08/25/leaves-6567141__340.jpg,"Leaves, Ginkgo, Botany, Plants, Bush",68,15,A00000511,Imgs/A00000511.jpg
https://cdn.pixabay.com/photo/2022/04/03/22/58/hibiscus-7110010__340.jpg,"Hibiscus, Flowers, Plant, Petals, Bloom",10,14,A00000512,Imgs/A00000512.jpg
https://cdn.pixabay.com/photo/2022/03/21/20/10/soup-7083894__340.jpg,"Soup, Kohlrabi, Hot Food, Dish",44,35,A00000513,Imgs/A00000513.jpg
