img_link,tags,likes,comments,img_id,img_path
https://cdn.pixabay.com/photo/2022/03/06/05/30/clouds-7050884__480.jpg,"Clouds, Sky, Atmosphere, Blue Sky",196,55,A00000001,Imgs/A00000001.jpg
https://cdn.pixabay.com/photo/2022/04/07/11/45/bird-7117346__340.jpg,"Bird, Ornithology, Hummingbird",76,20,A00000002,Imgs/A00000002.jpg
https://cdn.pixabay.com/photo/2022/02/28/15/28/sea-7039471__340.jpg,"Sea, Rainbow, Rainfall, Subtropical",282,106,A00000003,Imgs/A00000003.jpg
https://cdn.pixabay.com/photo/2022/04/04/02/52/cherry-blossoms-7110279__340.jpg,"Cherry Blossoms, Road, Japan, Sakura",42,11,A00000004,Imgs/A00000004.jpg
https://cdn.pixabay.com/photo/2022/04/09/18/06/cape-marguerite-7121992__340.jpg,"Cape Marguerite, Flower, Plant",39,15,A00000005,Imgs/A00000005.jpg
https://cdn.pixabay.com/photo/2021/11/13/23/06/tree-6792528__340.jpg,Relaxing Rest Under The Tree,522,108,A00000006,Imgs/A00000006.jpg
https://cdn.pixabay.com/photo/2022/04/07/02/56/cottontail-rabbit-7116707__340.jpg,"Cottontail Rabbit, Wild Rabbit, Grass",51,10,A00000007,Imgs/A00000007.jpg
https://cdn.pixabay.com/photo/2022/03/19/21/11/crocus-7079550__340.jpg,"Crocus, Flowers, Spring, Plant",135,44,A00000008,Imgs/A00000008.jpg
https://cdn.pixabay.com/photo/2022/04/09/17/30/coffee-7121939__340.jpg,"Coffee, Café, Vacation, Drink, Table",26,5,A00000009,Imgs/A00000009.jpg
https://cdn.pixabay.com/photo/2022/03/25/19/24/waterfall-7091641__340.jpg,"Waterfall, Fall, Epic, Nature, Light",96,21,A00000010,Imgs/A00000010.jpg
https://cdn.pixabay.com/photo/2021/08/25/20/42/field-6574455__340.jpg,"Field, Morning, Sunrise, Dawn, Nature",807,131,A00000011,Imgs/A00000011.jpg
https://cdn.pixabay.com/photo/2022/04/04/18/03/bird-7111988__340.jpg,"Bird, Robin, Birdwatching, Animal",69,19,A00000012,Imgs/A00000012.jpg
https://cdn.pixabay.com/photo/2022/04/04/07/58/seedlings-7110591__340.jpg,"Seedlings, Soil, Spring Flowers, Bloom",42,9,A00000013,Imgs/A00000013.jpg
https://cdn.pixabay.com/photo/2022/03/23/21/27/road-7087957__340.jpg,"Road, Highway, Countryside, Hills",53,14,A00000014,Imgs/A00000014.jpg
https://cdn.pixabay.com/photo/2022/03/27/15/03/cityscape-7095358__340.jpg,"Cityscape, Monochrome, Bridge, City",45,13,A00000015,Imgs/A00000015.jpg
https://cdn.pixabay.com/photo/2022/03/25/17/54/sakura-7091532__340.jpg,"Sakura, Cherry Blossoms, Spring, Water",70,12,A00000016,Imgs/A00000016.jpg
https://cdn.pixabay.com/photo/2022/04/01/19/03/background-7105471__480.jpg,"Background, Easter, Eggs, Template, Art",5,2,A00000017,Imgs/A00000017.jpg
https://cdn.pixabay.com/photo/2022/01/31/12/46/bird-6983434__340.jpg,"Bird, Indian Chat, Ornithology, Species",171,53,A00000018,Imgs/A00000018.jpg
https://cdn.pixabay.com/photo/2022/01/18/16/49/town-6947538__340.jpg,"Town, Night, Winter, Village, Season",109,15,A00000019,Imgs/A00000019.jpg
https://cdn.pixabay.com/photo/2022/04/09/17/42/flower-7121955__340.jpg,"Flower, Viola, Pansy, Blossom, Bloom",55,36,A00000020,Imgs/A00000020.jpg
https://cdn.pixabay.com/photo/2021/08/30/21/29/port-6587129__340.jpg,"Port, Lake, Architecture, Vacations",276,49,A00000021,Imgs/A00000021.jpg
https://cdn.pixabay.com/photo/2022/03/16/02/03/sunflowers-7071449__340.jpg,"Sunflowers, Flowers, Plant",54,21,A00000022,Imgs/A00000022.jpg
https://cdn.pixabay.com/photo/2022/03/28/18/41/coffee-7098126__340.jpg,"Coffee, Spring, Flowers, Morning",40,10,A00000023,Imgs/A00000023.jpg
https://cdn.pixabay.com/photo/2022/02/12/06/21/roys-peak-7008528__340.jpg,"Roys Peak, Wanaka, Lake, Mountains",69,19,A00000024,Imgs/A00000024.jpg
https://cdn.pixabay.com/photo/2021/11/21/21/14/mountain-6815304__340.jpg,"Thank you, everyone. Thank you for many downloads and likes.",197,0,A00000025,Imgs/A00000025.jpg
https://cdn.pixabay.com/photo/2021/08/22/15/48/nature-6565499__340.jpg,"Nature, Beach, Outdoors, Exploration",272,150,A00000026,Imgs/A00000026.jpg
https://cdn.pixabay.com/photo/2022/03/03/11/18/nature-7045125__340.jpg,The Danish West Coast of Jutland. Shot during sunset.,48,11,A00000027,Imgs/A00000027.jpg
https://cdn.pixabay.com/photo/2022/03/16/21/01/gentoo-penguin-7073391__340.jpg,"Gentoo Penguin, Penguin, Bird, Animal",93,22,A00000028,Imgs/A00000028.jpg
https://cdn.pixabay.com/photo/2021/11/26/20/45/lantern-6826698__340.jpg,"Lantern, Sea, Heaven, Beach, Water, Tree",243,31,A00000029,Imgs/A00000029.jpg
https://cdn.pixabay.com/photo/2022/04/03/05/03/easter-7108066__340.jpg,"Easter, Spring, Easter Bunny",17,10,A00000030,Imgs/A00000030.jpg
https://cdn.pixabay.com/photo/2018/01/14/23/12/nature-3082832__340.jpg,green trees on brown rock formation on lake during daytime,3098,495,A00000031,Imgs/A00000031.jpg
https://cdn.pixabay.com/photo/2022/02/27/19/46/tourist-attraction-7037967__340.jpg,"Tourist Attraction, Eiffel Tower, Travel",83,21,A00000032,Imgs/A00000032.jpg
https://cdn.pixabay.com/photo/2022/04/07/22/23/menhir-7118382__480.jpg,"Menhir, Stones, Clouds, Standing Stones",64,49,A00000033,Imgs/A00000033.jpg
https://cdn.pixabay.com/photo/2022/01/13/18/05/road-6935773__340.jpg,"Road, Trees, Winter, Frost, Snow, Path",133,24,A00000034,Imgs/A00000034.jpg
https://cdn.pixabay.com/photo/2022/04/10/07/03/bird-7122753__340.jpg,"Bird, Woodpecker",28,20,A00000035,Imgs/A00000035.jpg
https://cdn.pixabay.com/photo/2021/11/25/19/50/tape-6824489__340.jpg,"Tape, Cassette, Music, Retro, Classic",134,20,A00000036,Imgs/A00000036.jpg
https://cdn.pixabay.com/photo/2022/01/10/15/29/wind-mills-6928590__340.jpg,"Wind Mills, Energy, Clouds, Power",144,101,A00000037,Imgs/A00000037.jpg
https://cdn.pixabay.com/photo/2022/02/15/07/27/travel-7014427__340.jpg,"Travel, Tourism, Square, Tartini, Piran",70,19,A00000038,Imgs/A00000038.jpg
https://cdn.pixabay.com/photo/2022/04/11/04/33/easter-eggs-7124718__340.jpg,"Easter Eggs, Colored Eggs, Nest, Eggs",29,0,A00000039,Imgs/A00000039.jpg
https://cdn.pixabay.com/photo/2022/02/07/22/27/winter-7000429__340.jpg,"Winter, Season, Nature, Outdoors, Travel",111,24,A00000040,Imgs/A00000040.jpg
https://cdn.pixabay.com/photo/2022/04/11/09/40/glacier-7125386__340.jpg,"Glacier, Dying Glaciers, Melting Glacier",36,27,A00000041,Imgs/A00000041.jpg
https://cdn.pixabay.com/photo/2021/11/01/21/31/forest-6761846__340.jpg,"Forest, Jungle, Tropical, Green, Nature",135,22,A00000042,Imgs/A00000042.jpg
https://cdn.pixabay.com/photo/2022/02/05/08/13/tulip-6994245__340.jpg,"Tulip, Flower, Bloom, Blossom, Petals",92,35,A00000043,Imgs/A00000043.jpg
https://cdn.pixabay.com/photo/2022/04/07/13/06/flowers-7117461__340.jpg,"Flowers, Pink Flowers, Petals",62,0,A00000044,Imgs/A00000044.jpg
https://cdn.pixabay.com/photo/2022/02/22/03/22/passiflora-7027917__340.jpg,"Passiflora, Passion Flower, Flower",97,66,A00000045,Imgs/A00000045.jpg
https://cdn.pixabay.com/photo/2021/11/02/21/57/prayer-6764197__340.jpg,"Prayer, Faith, Religion, Hope, Blessing",175,57,A00000046,Imgs/A00000046.jpg
https://cdn.pixabay.com/photo/2022/04/09/10/13/galaxy-7121195__340.jpg,"Galaxy, Space, Universe, Star, Cosmos",45,40,A00000047,Imgs/A00000047.jpg
https://cdn.pixabay.com/photo/2022/03/31/09/25/dragonfly-7102558__480.jpg,"Dragonfly, Nature, Insect, Macro",19,3,A00000048,Imgs/A00000048.jpg
https://cdn.pixabay.com/photo/2022/01/10/18/09/budapest-6928973__340.jpg,"Budapest, Hungary, Architecture, Church",107,21,A00000049,Imgs/A00000049.jpg
https://cdn.pixabay.com/photo/2022/03/16/11/27/trees-7072255__340.jpg,"Trees, Forest, Leaves, Foliage, Magic",66,18,A00000050,Imgs/A00000050.jpg
https://cdn.pixabay.com/photo/2021/12/11/07/59/hotel-6862159__340.jpg,Das war bei meinem Aufenthalt in der Reha Klinik Klausenbach. Die liegt in Nordrach genauer in der Kolonie! Es wunderbarer Ort. Wie gemacht für die Erholung! Es gibt einen tollen Film mit Heike Makatsch als Dr. Hope Bridges Adams Lehmann als erste Ärztin 1880!,94,14,A00000051,Imgs/A00000051.jpg
https://cdn.pixabay.com/photo/2021/12/22/16/50/landscape-6887936__340.jpg,"This is a tree plantation near the summit of Mt. Hiei (848m). The site is owned and managed by Enryaku-ji temple. The trees are Hinoki cypress, which is very useful for constructions and crafts. In the future, the woods are used for reconstruction of old temple buildings.",160,45,A00000052,Imgs/A00000052.jpg
https://cdn.pixabay.com/photo/2022/04/07/13/08/flowers-7117464__340.jpg,"Flowers, Growth, Nature, Blossom, Bloom",63,0,A00000053,Imgs/A00000053.jpg
https://cdn.pixabay.com/photo/2022/02/04/10/31/cow-6992475__340.jpg,My baby (or babies) are due any day! ☺️,155,142,A00000054,Imgs/A00000054.jpg
https://cdn.pixabay.com/photo/2022/01/02/19/43/port-6910972__340.jpg,"Port, Ship, Boat, Sweden, Sea",89,22,A00000055,Imgs/A00000055.jpg
https://cdn.pixabay.com/photo/2022/04/08/21/42/heron-7120365__340.jpg,"Photographed on February 29, 2021 - the Pixabay license FORBIDS selling images as is on stock sites or elsewhere. Here is a link to the licence: https://pixabay.com/service/license/",34,51,A00000056,Imgs/A00000056.jpg
https://cdn.pixabay.com/photo/2021/11/01/13/58/leaf-6760484__340.jpg,"Leaf, Nature, Autumn, Fall, Season, Leaf",171,53,A00000057,Imgs/A00000057.jpg
https://cdn.pixabay.com/photo/2021/08/27/18/50/water-6579313__340.jpg,"Water, Trolltunga, Ringedalsvannet",202,45,A00000058,Imgs/A00000058.jpg
https://cdn.pixabay.com/photo/2021/12/01/18/17/cat-6838844__340.jpg,"Cat, European Shorthair, Pet, Feline",156,49,A00000059,Imgs/A00000059.jpg
https://cdn.pixabay.com/photo/2022/01/26/20/43/baboon-6969935__340.jpg,"Baboon, Animal, Wildlife, Gesture",140,41,A00000060,Imgs/A00000060.jpg
https://cdn.pixabay.com/photo/2022/04/10/19/28/savoy-7124124__340.jpg,"Savoy, Cabbage, Vegetables, Carrots",28,20,A00000061,Imgs/A00000061.jpg
https://cdn.pixabay.com/photo/2022/03/16/04/08/koi-fish-7071556__480.jpg,"Koi Fish, Fish, Pond, Water, Koi",54,64,A00000062,Imgs/A00000062.jpg
https://cdn.pixabay.com/photo/2021/07/09/02/29/family-6398107__340.jpg,"Family, Beach, People, Ocean, Family",219,57,A00000063,Imgs/A00000063.jpg
https://cdn.pixabay.com/photo/2022/02/26/21/47/elephant-7036431__340.jpg,"Elephant, Baby Elephant, Animals",104,35,A00000064,Imgs/A00000064.jpg
https://cdn.pixabay.com/photo/2022/04/10/19/28/savoy-7124124__340.jpg,"Savoy, Cabbage, Vegetables, Carrots",24,16,A00000065,Imgs/A00000065.jpg
https://cdn.pixabay.com/photo/2022/04/10/10/08/ranunculus-7123057__340.jpg,Add a description (optional),25,15,A00000066,Imgs/A00000066.jpg
https://cdn.pixabay.com/photo/2022/04/08/17/33/great-cormorant-7119976__340.jpg,"Great Cormorant, Bird",36,24,A00000067,Imgs/A00000067.jpg
https://cdn.pixabay.com/photo/2022/04/10/19/07/flower-7124081__340.jpg,"Flower, Daffodil, Petals, Plant",21,14,A00000068,Imgs/A00000068.jpg
https://cdn.pixabay.com/photo/2022/01/28/18/46/sea-6975501__340.jpg,"Sea, Waves, Storm, Sky, Clouds, Overcast",102,38,A00000069,Imgs/A00000069.jpg
https://cdn.pixabay.com/photo/2017/02/08/17/24/fantasy-2049567__340.jpg,"Fantasy, Butterflies, Mushrooms, Forest",3322,536,A00000070,Imgs/A00000070.jpg
https://cdn.pixabay.com/photo/2022/03/15/15/19/child-7070570__340.jpg,"Child, Boy, Flowers, Meadow, Cute, Kid",43,2,A00000071,Imgs/A00000071.jpg
https://cdn.pixabay.com/photo/2022/04/06/12/18/grass-7115462__340.jpg,"Grass, Plants, Oats, Ear, Barley",46,44,A00000072,Imgs/A00000072.jpg
https://cdn.pixabay.com/photo/2021/10/14/13/50/book-6709160__340.jpg,"Book, Literature, Reading, Library",130,57,A00000073,Imgs/A00000073.jpg
https://cdn.pixabay.com/photo/2022/04/06/13/59/wood-anemones-7115637__340.jpg,"Wood Anemones, Anemone, Buttercups",46,39,A00000074,Imgs/A00000074.jpg
https://cdn.pixabay.com/photo/2017/12/15/13/51/polynesia-3021072__340.jpg,white and red boat on beach during daytime,2610,499,A00000075,Imgs/A00000075.jpg
https://cdn.pixabay.com/photo/2022/04/03/09/30/flower-7108476__340.jpg,"Flower, Bee, Pollination, Bloom, Insect",50,68,A00000076,Imgs/A00000076.jpg
https://cdn.pixabay.com/photo/2022/04/11/18/14/letter-box-7126374__480.jpg,"Letter Box, Email Delivery, Post Office",17,12,A00000077,Imgs/A00000077.jpg
https://cdn.pixabay.com/photo/2022/01/17/23/10/sunset-6945937__340.jpg,Calm Lake At Sunset,59,18,A00000078,Imgs/A00000078.jpg
https://cdn.pixabay.com/photo/2022/04/04/22/33/sunflowers-7112463__340.jpg,"Illustration, sunflowers farming,",72,77,A00000079,Imgs/A00000079.jpg
https://cdn.pixabay.com/photo/2022/02/19/21/46/beach-7023446__340.jpg,"Beach, Sand, Sea, North Sea, Winter",30,6,A00000080,Imgs/A00000080.jpg
https://cdn.pixabay.com/photo/2022/01/13/16/37/trees-6935614__340.jpg,"Trees, Nature, Winter, Season, Outdoors",90,18,A00000081,Imgs/A00000081.jpg
https://cdn.pixabay.com/photo/2022/03/02/14/25/flower-7043267__340.jpg,"Flower, Rose, Bloom, Blossom, Botany",107,91,A00000082,Imgs/A00000082.jpg
https://cdn.pixabay.com/photo/2021/12/27/11/55/winter-6897046__340.jpg,"Winter, Frost, Nature, Texture, Macro",113,32,A00000083,Imgs/A00000083.jpg
https://cdn.pixabay.com/photo/2021/12/28/14/30/bird-6899457__340.jpg,"Bird, Blackbird, Ornithology, Species",109,27,A00000084,Imgs/A00000084.jpg
https://cdn.pixabay.com/photo/2022/04/10/14/27/trees-7123499__340.jpg,"Trees, Rural, Clouds, Nature, Landscape",14,8,A00000085,Imgs/A00000085.jpg
https://cdn.pixabay.com/photo/2022/01/16/20/38/coffee-6943139__340.jpg,"Coffee, Pencils, Eraser, Office",69,9,A00000086,Imgs/A00000086.jpg
https://cdn.pixabay.com/photo/2021/07/18/04/00/lotus-6474572__340.jpg,"Lotus, Flower, Lotus Flower, Pink Flower",279,45,A00000087,Imgs/A00000087.jpg
https://cdn.pixabay.com/photo/2022/04/01/15/31/bus-7105041__340.jpg,Es sind noch Plätze frei…,43,34,A00000088,Imgs/A00000088.jpg
https://cdn.pixabay.com/photo/2022/01/21/19/21/crocus-6955548__340.jpg,"Crocus, Flowers, Plants, Purple Crocus",77,16,A00000089,Imgs/A00000089.jpg
https://cdn.pixabay.com/photo/2022/04/11/09/18/birds-7125333__340.jpg,"Taken in March 21, 2022",16,7,A00000090,Imgs/A00000090.jpg
https://cdn.pixabay.com/photo/2021/12/12/22/48/mountain-6867146__340.jpg,"Mountain, Summit, Forest, Winter, Clouds",82,8,A00000091,Imgs/A00000091.jpg
https://cdn.pixabay.com/photo/2022/04/10/07/33/ice-cream-cone-7122797__340.jpg,"Ice Cream Cone, Ice Squirrel, Flower",16,11,A00000092,Imgs/A00000092.jpg
https://cdn.pixabay.com/photo/2022/04/09/09/29/flower-7121113__480.jpg,"Flower, Magnolia, Tree, Spring Flowers",8,2,A00000093,Imgs/A00000093.jpg
https://cdn.pixabay.com/photo/2022/04/06/09/46/flowers-7115215__340.jpg,"Flowers, Bouquet, Garden",47,26,A00000094,Imgs/A00000094.jpg
https://cdn.pixabay.com/photo/2022/03/04/09/02/winter-7046891__340.jpg,Help Ukraine! Stop the war!,56,15,A00000095,Imgs/A00000095.jpg
https://cdn.pixabay.com/photo/2022/04/03/08/33/jay-7108357__340.jpg,"Jay, Bird, Animal, Snow, Winter",62,48,A00000096,Imgs/A00000096.jpg
https://cdn.pixabay.com/photo/2022/04/09/07/14/dungeon-7120925__340.jpg,"Built in 1300-1400, the former Augustinian (Les Augustins, in French) convent in Toulouse (France) has become a museum.",17,11,A00000097,Imgs/A00000097.jpg
https://cdn.pixabay.com/photo/2022/04/11/09/16/birds-7125327__340.jpg,"Birds, Egyptian Goslings, Waterfowl",15,8,A00000098,Imgs/A00000098.jpg
https://cdn.pixabay.com/photo/2022/04/06/08/16/peach-blossom-7115083__340.jpg,"Peach Blossom, Flowers, Branch, Tree",41,58,A00000099,Imgs/A00000099.jpg
https://cdn.pixabay.com/photo/2021/12/01/15/32/happy-new-year-6838276__340.jpg,"Happy New Year, 2022, Regards, New Year",45,10,A00000100,Imgs/A00000100.jpg
https://cdn.pixabay.com/photo/2022/04/03/17/48/flowers-7109567__340.jpg,"Flowers, Botany, Quince",55,47,A00000101,Imgs/A00000101.jpg
https://cdn.pixabay.com/photo/2016/11/29/05/45/astronomy-1867616__340.jpg,"Astronomy, Bright, Constellation, Dark",2989,484,A00000102,Imgs/A00000102.jpg
https://cdn.pixabay.com/photo/2022/02/14/10/35/flowers-7012876__340.jpg,"Flowers, Bloom, Botany, Blossom, Nature",43,13,A00000103,Imgs/A00000103.jpg
https://cdn.pixabay.com/photo/2021/08/23/08/28/path-6567149__340.jpg,"Path, Rural, Nature, Road, Countryside",178,36,A00000104,Imgs/A00000104.jpg
https://cdn.pixabay.com/photo/2022/02/14/06/54/bird-7012586__340.jpg,"Bird, Ibis, Spiny Ibis, Ornithology",141,102,A00000105,Imgs/A00000105.jpg
https://cdn.pixabay.com/photo/2021/08/27/10/16/baby-6578335__340.jpg,"Baby, Girl, Portrait, Child, Daughter",179,54,A00000106,Imgs/A00000106.jpg
https://cdn.pixabay.com/photo/2021/12/20/15/01/christmas-tree-6883263__340.jpg,"Christmas Tree, Ornaments, Christmas",147,99,A00000107,Imgs/A00000107.jpg
https://cdn.pixabay.com/photo/2021/09/30/18/10/sunrise-6670717__340.jpg,"Sunrise, Mountains, Fog, Swabian Jura",140,27,A00000108,Imgs/A00000108.jpg
https://cdn.pixabay.com/photo/2022/04/05/22/54/giant-lily-7114496__480.jpg,Dorianthes Palmeri. 3 meters high. Makes her first flower at 40 years. Blooms only once in her life and dies... ***************************** Dorianthes Palmeri. 3 Meter hoch. Macht ihre erste Blume nach 40 Jahren. Blüht nur einmal in ihrem Leben und stirbt…,47,32,A00000109,Imgs/A00000109.jpg
https://cdn.pixabay.com/photo/2022/04/06/22/27/postcard-7116453__340.jpg,"Postcard, Greeting Card, Peacocks, Birds",31,36,A00000110,Imgs/A00000110.jpg
https://cdn.pixabay.com/photo/2022/01/25/04/42/bird-6965228__340.jpg,"Bird, Great Egret, Ornithology, Species",89,47,A00000111,Imgs/A00000111.jpg
https://cdn.pixabay.com/photo/2022/01/10/16/30/flowers-6928749__340.jpg,"Flowers, Grass, Coast, Cliff, Beach, Sea",79,12,A00000112,Imgs/A00000112.jpg
https://cdn.pixabay.com/photo/2021/12/18/17/11/flower-6879399__340.jpg,"Flower, Dandelion, Wildflower, Seeds",88,14,A00000113,Imgs/A00000113.jpg
https://cdn.pixabay.com/photo/2021/12/14/20/21/book-6871220__340.jpg,"Book, Page, Man, Stop, Shades, Paper",80,49,A00000114,Imgs/A00000114.jpg
https://cdn.pixabay.com/photo/2021/08/23/07/38/castle-6566978__340.jpg,"Castle, Monument, Park, Building",159,27,A00000115,Imgs/A00000115.jpg
https://cdn.pixabay.com/photo/2022/04/05/15/11/birds-7113827__340.jpg,"Birds, Greylag Goose, Ornithology",41,28,A00000116,Imgs/A00000116.jpg
https://cdn.pixabay.com/photo/2022/04/08/19/05/hyacinth-7120098__340.jpg,"Hyacinth, Flowers, Spring, Nature",15,9,A00000117,Imgs/A00000117.jpg
https://cdn.pixabay.com/photo/2022/04/05/00/25/bokeh-7112555__340.jpg,"Bokeh, Light, Background, Pattern, Art",27,27,A00000118,Imgs/A00000118.jpg
https://cdn.pixabay.com/photo/2022/04/02/10/53/easter-7106722__340.jpg,"Easter, Easter Bunny, Easter Decoration",55,87,A00000119,Imgs/A00000119.jpg
https://cdn.pixabay.com/photo/2021/11/26/17/26/desert-6826299__340.jpg,"Desert, Sand, Dunes, Dubai, Native",48,14,A00000120,Imgs/A00000120.jpg
https://cdn.pixabay.com/photo/2022/04/03/09/04/pforphoto-7108433__340.jpg,The Piano…,35,25,A00000121,Imgs/A00000121.jpg
https://cdn.pixabay.com/photo/2020/04/25/12/14/tech-5090539__340.jpg,"Tech, Circle, Technology, Abstract",404,109,A00000122,Imgs/A00000122.jpg
https://cdn.pixabay.com/photo/2022/04/06/09/46/flowers-7115217__340.jpg,"Flowers, Hyacinth, Garden",40,28,A00000123,Imgs/A00000123.jpg
https://cdn.pixabay.com/photo/2022/03/28/05/17/cherry-blossoms-7096607__340.jpg,"Cherry Blossoms, Pink Flowers, Sakura",61,24,A00000124,Imgs/A00000124.jpg
https://cdn.pixabay.com/photo/2022/04/08/12/12/coffee-7119373__480.jpg,"Coffee, Template, Coffee Stain, Dirty",26,19,A00000125,Imgs/A00000125.jpg
https://cdn.pixabay.com/photo/2022/02/02/13/50/happy-easter-6988491__340.jpg,"Happy Easter, Spring, Decoration, Theme",29,10,A00000126,Imgs/A00000126.jpg
https://cdn.pixabay.com/photo/2021/12/12/01/15/lotus-6863937__340.jpg,"Lotus, Flowers, Pond, Lily Pads",101,23,A00000127,Imgs/A00000127.jpg
https://cdn.pixabay.com/photo/2022/01/21/07/21/ring-tailed-lemur-6954076__340.jpg,"Ring Tailed Lemur, Lemur, Group, Cub",160,115,A00000128,Imgs/A00000128.jpg
https://cdn.pixabay.com/photo/2022/04/07/04/03/bird-7116757__340.jpg,"El estornino pinto, o estornino común, (Sturnus vulgaris)​ es una especie de ave passeriforme de la familia Sturnidae nativa del Paleártico. En Argentina fue introducido hace unos años y hoy se reproduce abundantemente en el sudeste de la Provincia de Buenos Aires.",23,19,A00000129,Imgs/A00000129.jpg
https://cdn.pixabay.com/photo/2021/10/11/09/04/nature-6699893__340.jpg,"Nature, Spruce, Evergreen, Branches",99,21,A00000130,Imgs/A00000130.jpg
https://cdn.pixabay.com/photo/2022/04/08/07/22/tablets-7118912__340.jpg,"Tablets, Drugs, Powder",22,16,A00000131,Imgs/A00000131.jpg
https://cdn.pixabay.com/photo/2022/01/17/08/27/white-flowers-6944139__340.jpg,"White Flowers, Flowers, Nature",49,11,A00000132,Imgs/A00000132.jpg
https://cdn.pixabay.com/photo/2021/09/14/14/46/cologne-6624212__340.jpg,"Cologne, Cathedral, Bridge, Night, River",98,27,A00000133,Imgs/A00000133.jpg
https://cdn.pixabay.com/photo/2015/12/01/20/28/road-1072823__340.jpg,"Road, Forest, Fall, Autumn, Season",5214,1126,A00000134,Imgs/A00000134.jpg
https://cdn.pixabay.com/photo/2022/04/08/06/13/bird-7118767__340.jpg,"Bird, Geese, Ornithology, Species, Fauna",23,15,A00000135,Imgs/A00000135.jpg
https://cdn.pixabay.com/photo/2022/04/04/15/16/flowers-7111580__340.jpg,Foto von Ende März 2022,27,20,A00000136,Imgs/A00000136.jpg
https://cdn.pixabay.com/photo/2021/10/10/20/33/mehtab-bagh-6698669__340.jpg,"Mehtab Bagh, India, Taj Mahal, Temple",73,15,A00000137,Imgs/A00000137.jpg
https://cdn.pixabay.com/photo/2022/04/09/05/35/tulips-7120798__340.jpg,"Tulips, Flower, Plant, Flora",10,4,A00000138,Imgs/A00000138.jpg
https://cdn.pixabay.com/photo/2022/04/04/06/59/canada-goose-7110494__340.jpg,"Canada Goose, Goose, Swim, Water Bird",57,0,A00000139,Imgs/A00000139.jpg
https://cdn.pixabay.com/photo/2022/03/02/19/27/earth-7043847__340.jpg,"Earth, Planet, Homeland, Mankind",36,8,A00000140,Imgs/A00000140.jpg
https://cdn.pixabay.com/photo/2022/04/07/04/04/starling-7116759__480.jpg,"El estornino pinto, o estornino común, (Sturnus vulgaris)​ es una especie de ave passeriforme de la familia Sturnidae nativa del Paleártico. En Argentina fue introducido hace unos años y hoy se reproduce abundantemente en el sudeste de la Provincia de Buenos Aires.",22,17,A00000141,Imgs/A00000141.jpg
https://cdn.pixabay.com/photo/2022/03/28/20/47/house-7098314__340.jpg,"Composition, lake view",81,81,A00000142,Imgs/A00000142.jpg
https://cdn.pixabay.com/photo/2022/04/08/17/33/bird-7119983__340.jpg,"Bird, Blackbird, Songbird, Fauna, Animal",18,11,A00000143,Imgs/A00000143.jpg
https://cdn.pixabay.com/photo/2022/04/10/10/04/bird-7123044__340.jpg,"Durian Redstart. In Japan, it is a winter bird, wintering in regions without snow cover and inhabiting flat to low mountain farmlands, residential areas, parks, and riverbanks.",10,6,A00000144,Imgs/A00000144.jpg
https://cdn.pixabay.com/photo/2021/11/09/07/29/newborn-6780840__340.jpg,"Newborn, Baby, Costume, Sleeping",91,21,A00000145,Imgs/A00000145.jpg
https://cdn.pixabay.com/photo/2022/04/02/20/46/cat-7107728__340.jpg,"Cat, Grass, Backyard, Outdoors, Kitten",54,36,A00000146,Imgs/A00000146.jpg
https://cdn.pixabay.com/photo/2021/06/22/16/39/arch-6356637__340.jpg,"Arch, Alley, Street, Road, Eiffel Tower",261,51,A00000147,Imgs/A00000147.jpg
https://cdn.pixabay.com/photo/2022/03/21/16/12/blackbird-7083494__340.jpg,"Blackbird, Bird, Animal, Worm, Eating",70,51,A00000148,Imgs/A00000148.jpg
https://cdn.pixabay.com/photo/2022/04/06/10/08/dog-7115247__340.jpg,"Dog, Golden Retriever, Water, Swim, Lake",33,22,A00000149,Imgs/A00000149.jpg
https://cdn.pixabay.com/photo/2022/04/09/21/10/clouds-7122287__340.jpg,"Clouds, Sky, Atmosphere, Grey Clouds",5,1,A00000150,Imgs/A00000150.jpg
https://cdn.pixabay.com/photo/2022/04/12/12/02/flowers-7127847__340.jpg,"Flowers, Spring, Seasonal, Nature, Bloom",17,14,A00000151,Imgs/A00000151.jpg
https://cdn.pixabay.com/photo/2022/03/31/14/12/flower-7103109__340.jpg,"Flower, Liverflower, Early Bloomer",74,57,A00000152,Imgs/A00000152.jpg
https://cdn.pixabay.com/photo/2021/05/29/17/35/car-6293917__340.jpg,"Car, Beach, Sunset, Desktop Wallpaper",37,7,A00000153,Imgs/A00000153.jpg
https://cdn.pixabay.com/photo/2021/10/23/03/35/mountain-6734031__340.jpg,"Mountain, Summit, Snow, Winter",85,20,A00000154,Imgs/A00000154.jpg
https://cdn.pixabay.com/photo/2022/04/08/11/47/daffodil-7119341__340.jpg,Aufgenommen am 5.3.2022,29,22,A00000155,Imgs/A00000155.jpg
https://cdn.pixabay.com/photo/2021/08/29/08/49/petit-minou-lighthouse-6582717__340.jpg,"Petit Minou Lighthouse, Lighthouse, Sea",120,29,A00000156,Imgs/A00000156.jpg
https://cdn.pixabay.com/photo/2018/01/30/22/50/forest-3119826__480.jpg,"Forest, Twilight, Nature, Trees, Woods",1417,188,A00000157,Imgs/A00000157.jpg
https://cdn.pixabay.com/photo/2022/04/07/17/32/european-shorthair-7118037__340.jpg,"European Shorthair, Cat, Pet, Animal",18,8,A00000158,Imgs/A00000158.jpg
https://cdn.pixabay.com/photo/2022/04/11/19/35/easter-bunny-7126487__340.jpg,"Easter Bunny, Easter, Easter Festival",9,7,A00000159,Imgs/A00000159.jpg
https://cdn.pixabay.com/photo/2022/03/28/17/19/mountains-7097981__340.jpg,"Mountains, Meadow, Cabin, Clouds, Herb",63,55,A00000160,Imgs/A00000160.jpg
https://cdn.pixabay.com/photo/2021/07/27/16/23/buildings-6497337__340.jpg,"Buildings, Town, Road, Hills, Sunset",132,19,A00000161,Imgs/A00000161.jpg
https://cdn.pixabay.com/photo/2022/03/14/20/54/city-7069010__340.jpg,"City, Travel, Tourism, Mexico City",19,5,A00000162,Imgs/A00000162.jpg
https://cdn.pixabay.com/photo/2022/04/09/09/29/magnolia-7121115__340.jpg,"Magnolia, Flower, Tree, Spring Flowers",2,1,A00000163,Imgs/A00000163.jpg
https://cdn.pixabay.com/photo/2022/04/10/19/17/donkey-7124096__340.jpg,"Donkey, Animal, Draft Animal, Mammal",10,0,A00000164,Imgs/A00000164.jpg
https://cdn.pixabay.com/photo/2022/04/08/11/46/weave-7119337__340.jpg,Aufgenommen am 20.3.2021,27,19,A00000165,Imgs/A00000165.jpg
https://cdn.pixabay.com/photo/2022/04/09/14/54/fields-7121593__340.jpg,"Fields, Nature, Landscape, Meadow, Rural",14,12,A00000166,Imgs/A00000166.jpg
