img_link,tags,likes,comments,img_id,img_path
https://cdn.pixabay.com/photo/2021/07/20/04/17/tasmanian-devil-6479685__340.jpg,"Tasmanian Devil, Marsupial, Wildlife",222,218,A00000514,Imgs/A00000514.jpg
https://cdn.pixabay.com/photo/2021/01/29/06/28/marguerite-5959944__340.jpg,"Marguerite, White, Flower, Daisy, Plant",304,152,A00000515,Imgs/A00000515.jpg
https://cdn.pixabay.com/photo/2022/04/05/07/42/cherry-blossoms-7112990__340.jpg,сакура,7,5,A00000516,Imgs/A00000516.jpg
https://cdn.pixabay.com/photo/2022/02/17/05/57/leaves-7018017__340.jpg,"Leaves, Macro, Frost, Garden, Plant",30,13,A00000517,Imgs/A00000517.jpg
https://cdn.pixabay.com/photo/2022/04/10/19/33/house-7124141__340.jpg,"House, Building, Balconies, Apartments",6,1,A00000518,Imgs/A00000518.jpg
https://cdn.pixabay.com/photo/2022/04/12/12/41/spring-7127911__340.jpg,"Spring, Cherry Blossom, Spring Flowers",0,0,A00000519,Imgs/A00000519.jpg
https://cdn.pixabay.com/photo/2022/03/12/15/36/daffodil-7064409__340.jpg,"Daffodil, Narcissus, Yellow Daffodil",64,65,A00000520,Imgs/A00000520.jpg
https://cdn.pixabay.com/photo/2021/10/16/08/41/animal-6714423__340.jpg,"Animal, Elephant, Fauna, Species, Africa",86,18,A00000521,Imgs/A00000521.jpg
https://cdn.pixabay.com/photo/2022/04/11/12/29/sunset-7125617__340.jpg,"Sunset, Volga Region, Nature, Sky",1,0,A00000522,Imgs/A00000522.jpg
https://cdn.pixabay.com/photo/2022/04/09/16/23/flora-7121768__340.jpg,"Flora, Water Lily, Wildflower, Pond",2,0,A00000523,Imgs/A00000523.jpg
https://cdn.pixabay.com/photo/2021/12/11/19/21/breakfast-6863479__480.jpg,"Breakfast, Drink, Coffee, Caffeine",30,5,A00000524,Imgs/A00000524.jpg
https://cdn.pixabay.com/photo/2022/04/07/19/16/chicken-7118192__340.jpg,"Chicken, Rooster, Poultry, Bird",5,2,A00000525,Imgs/A00000525.jpg
https://cdn.pixabay.com/photo/2021/07/22/01/01/parrot-6484206__340.jpg,"Parrot, Bird, Perched, Animal, Colorful",149,145,A00000526,Imgs/A00000526.jpg
https://cdn.pixabay.com/photo/2022/02/23/12/03/fishing-boats-7030597__340.jpg,"Fishing Boats, Port, The Baltic Sea",64,88,A00000527,Imgs/A00000527.jpg
https://cdn.pixabay.com/photo/2022/02/20/00/45/easter-basket-7023539__340.jpg,"Easter Basket, Easter, Flowers, Spring",83,74,A00000528,Imgs/A00000528.jpg
https://cdn.pixabay.com/photo/2021/10/06/08/34/seagull-6685075__340.jpg,"Seagull, Bird, Perched, Animal, Feathers",53,10,A00000529,Imgs/A00000529.jpg
