img_link,tags,likes,comments,img_id,img_path
https://cdn.pixabay.com/photo/2022/04/08/13/45/flowers-7119514__340.jpg,This is now the season for Cherry blossoms in Japan. Have you ever heard of “hanami”? We sit under the cherry trees and eat and drink with our friends.,14,8,A00000167,Imgs/A00000167.jpg
https://cdn.pixabay.com/photo/2022/03/19/08/45/alley-7078098__340.jpg,In einem kleinen Städtchen ...,57,33,A00000168,Imgs/A00000168.jpg
https://cdn.pixabay.com/photo/2022/04/06/06/30/drake-7114868__340.jpg,"Drake, Waterbird, Wings",20,19,A00000169,Imgs/A00000169.jpg
https://cdn.pixabay.com/photo/2021/11/17/10/57/pine-cone-6803226__340.jpg,"Pine Cone, Fir Green, Fir Branch",126,43,A00000170,Imgs/A00000170.jpg
https://cdn.pixabay.com/photo/2021/10/15/22/59/heron-6713611__340.jpg,"Heron, Great Egret, River, Lake, Pond",163,127,A00000171,Imgs/A00000171.jpg
https://cdn.pixabay.com/photo/2021/10/08/06/45/seagulls-6690361__340.jpg,"Seagulls, Birds, Nature, Ocean, Sea, Sky",121,30,A00000172,Imgs/A00000172.jpg
https://cdn.pixabay.com/photo/2021/07/22/21/55/mountains-6486093__480.jpg,"Mountains, Nature, Tourism, Hike, Alpine",122,24,A00000173,Imgs/A00000173.jpg
https://cdn.pixabay.com/photo/2022/04/04/08/43/road-7110643__340.jpg,"Road, Mountain, Countryside, Landscape",29,0,A00000174,Imgs/A00000174.jpg
https://cdn.pixabay.com/photo/2021/11/11/16/29/tree-6786654__340.jpg,"Tree, Leaves, Autumn, Season, Nature",89,21,A00000175,Imgs/A00000175.jpg
https://cdn.pixabay.com/photo/2022/03/23/17/41/fantasy-7087606__340.jpg,"Fantasy, Elf, Light, Plants, Bird Magic",32,17,A00000176,Imgs/A00000176.jpg
https://cdn.pixabay.com/photo/2022/03/12/09/27/couple-7063784__340.jpg,"Couple, Meadow, Walking, Nature, Sunset",17,5,A00000177,Imgs/A00000177.jpg
https://cdn.pixabay.com/photo/2016/12/16/15/25/christmas-1911637__340.jpg,"Christmas, Background, Flat Lay",2860,460,A00000178,Imgs/A00000178.jpg
https://cdn.pixabay.com/photo/2022/04/06/17/40/blackthorn-7116000__340.jpg,"Blackthorn, Sloe, Winter, Prunus Spinosa",23,20,A00000179,Imgs/A00000179.jpg
https://cdn.pixabay.com/photo/2021/08/27/19/55/boat-6579441__340.jpg,"Boat, River, Forest, Landscape, Woods",145,26,A00000180,Imgs/A00000180.jpg
https://cdn.pixabay.com/photo/2022/04/09/18/25/walnuts-7122043__340.jpg,"Walnuts, Nuts, Food, Healthy, Nutrition",11,5,A00000181,Imgs/A00000181.jpg
https://cdn.pixabay.com/photo/2022/04/12/04/46/climate-change-7127153__340.jpg,"Climate Change, Protest, People",12,9,A00000182,Imgs/A00000182.jpg
https://cdn.pixabay.com/photo/2021/08/08/15/45/mountains-6531264__340.jpg,"Mountains, Sunset, Germany, Fortress",116,26,A00000183,Imgs/A00000183.jpg
https://cdn.pixabay.com/photo/2021/11/27/18/28/candles-6828695__340.jpg,"Candles, Candlelight, Christmas",122,60,A00000184,Imgs/A00000184.jpg
https://cdn.pixabay.com/photo/2022/02/19/08/48/flower-7022112__340.jpg,"Flower, Butterfly, Fantasy, Spring",97,72,A00000185,Imgs/A00000185.jpg
https://cdn.pixabay.com/photo/2022/04/04/10/39/australian-wood-duck-7110865__340.jpg,"Australian Wood Duck, Duck, Bird",45,44,A00000186,Imgs/A00000186.jpg
https://cdn.pixabay.com/photo/2021/10/04/16/42/dog-6680642__340.jpg,"Dog, Puppy, Pet, Cute, Doggy, Animal",89,16,A00000187,Imgs/A00000187.jpg
https://cdn.pixabay.com/photo/2022/03/31/05/07/cherry-blossom-7102224__340.jpg,"Cherry Blossom, Spring, Nature, Flowers",57,48,A00000188,Imgs/A00000188.jpg
https://cdn.pixabay.com/photo/2021/12/26/19/36/christmas-tree-6895765__480.jpg,"Christmas Tree, Holiday, Season",54,11,A00000189,Imgs/A00000189.jpg
https://cdn.pixabay.com/photo/2021/07/26/22/04/sea-shell-6495338__340.jpg,"Sea Shell, Giant Conch",206,95,A00000190,Imgs/A00000190.jpg
https://cdn.pixabay.com/photo/2021/02/05/18/05/paper-5985445__340.jpg,"Paper, Crumpled, Texture, Shadows, Fold",186,38,A00000191,Imgs/A00000191.jpg
https://cdn.pixabay.com/photo/2022/03/31/14/16/bee-7103114__340.jpg,"Bee, Pollination, Entomology, Macro",57,41,A00000192,Imgs/A00000192.jpg
https://cdn.pixabay.com/photo/2022/04/06/05/26/butterfly-7114816__340.jpg,"Butterfly, Aurora Butterfly, Meadow",25,16,A00000193,Imgs/A00000193.jpg
https://cdn.pixabay.com/photo/2021/12/02/13/02/candles-6840499__340.jpg,4 Weihnachtskerzen,70,24,A00000194,Imgs/A00000194.jpg
https://cdn.pixabay.com/photo/2022/04/06/14/27/mute-swan-7115661__340.jpg,Add a description (optional),40,33,A00000195,Imgs/A00000195.jpg
https://cdn.pixabay.com/photo/2022/04/09/06/20/tulip-7120843__340.jpg,"Tulip, Spring, Flowering, Flower",9,2,A00000196,Imgs/A00000196.jpg
https://cdn.pixabay.com/photo/2022/03/22/19/29/town-7085835__340.jpg,"Town, Countryside, Nature, Landscape",69,62,A00000197,Imgs/A00000197.jpg
https://cdn.pixabay.com/photo/2022/04/11/07/30/birds-7124996__340.jpg,"El Hornero ( Furnarius rufus ) es una especie de ave paseriforme perteneciente a la familia de los furnáridos, y compone, junto con otras cinco especies el género Furnarius. El hornero es endémico de Sudamérica meridional y es el ave nacional de la República Argentina.",7,6,A00000198,Imgs/A00000198.jpg
https://cdn.pixabay.com/photo/2022/04/05/12/00/cherry-blossom-7113414__340.jpg,"Cherry Blossom, Flowers, Spring, Sakura",32,0,A00000199,Imgs/A00000199.jpg
https://cdn.pixabay.com/photo/2022/04/07/23/58/fantasy-7118471__340.jpg,"Fantasy, No Truth, Silence, Bound",19,24,A00000200,Imgs/A00000200.jpg
https://cdn.pixabay.com/photo/2022/03/01/09/15/salad-7040875__340.jpg,"Salad, Fruit, Berry, Healthy, Vitamins",30,10,A00000201,Imgs/A00000201.jpg
https://cdn.pixabay.com/photo/2021/11/01/08/39/petit-minou-lighthouse-6759731__340.jpg,"Petit Minou Lighthouse, Lighthouse, Sea",61,15,A00000202,Imgs/A00000202.jpg
https://cdn.pixabay.com/photo/2022/04/11/19/05/easter-bunny-7126452__340.jpg,"Easter Bunny, Easter, Easter Decorations",12,8,A00000203,Imgs/A00000203.jpg
https://cdn.pixabay.com/photo/2022/04/09/22/33/bird-7122361__340.jpg,"Bird, Heron, Ornithology, Species, Fauna",12,7,A00000204,Imgs/A00000204.jpg
https://cdn.pixabay.com/photo/2022/04/01/08/57/shepherds-purses-7104384__480.jpg,"Shepherd'S-Purses, Capsella, Grass",45,40,A00000205,Imgs/A00000205.jpg
https://cdn.pixabay.com/photo/2022/04/07/11/55/bernkastel-kues-7117366__340.jpg,"Bernkastel-Kues, Germany, Cityscape",20,10,A00000206,Imgs/A00000206.jpg
https://cdn.pixabay.com/photo/2021/04/21/13/20/cherry-blossoms-6196363__340.jpg,"Cherry Blossoms, Sakura, Flowers",406,211,A00000207,Imgs/A00000207.jpg
https://cdn.pixabay.com/photo/2022/04/11/20/31/purple-flowers-7126569__340.jpg,"Purple Flowers, Flowers, Pasqueflowers",5,2,A00000208,Imgs/A00000208.jpg
https://cdn.pixabay.com/photo/2021/03/02/01/07/cyberpunk-6061251__340.jpg,"Cyberpunk, Street, City, Platform",220,32,A00000209,Imgs/A00000209.jpg
https://cdn.pixabay.com/photo/2022/03/29/12/31/leaves-7099402__340.jpg,"Leaves, Growth, Botany, Nature, Plant",61,16,A00000210,Imgs/A00000210.jpg
https://cdn.pixabay.com/photo/2022/04/10/10/34/flower-7123108__340.jpg,"Flower, Petals, Baby Rose",8,4,A00000211,Imgs/A00000211.jpg
https://cdn.pixabay.com/photo/2022/03/05/09/23/birds-7048729__340.jpg,"Birds, Duck, Ornithology, Species, Fauna",103,79,A00000212,Imgs/A00000212.jpg
https://cdn.pixabay.com/photo/2022/04/10/18/04/robin-7123932__340.jpg,"Robin, Bird, Beak, Feathers, Plumage",4,2,A00000213,Imgs/A00000213.jpg
https://cdn.pixabay.com/photo/2018/06/13/18/20/waves-3473335__340.jpg,"Waves, Sea, Ocean, Beach, Blue Water",1807,310,A00000214,Imgs/A00000214.jpg
https://cdn.pixabay.com/photo/2022/03/05/22/13/daffodil-7050408__340.jpg,"Daffodil, Flower, Yellow Flower, Petals",87,73,A00000215,Imgs/A00000215.jpg
https://cdn.pixabay.com/photo/2022/04/09/16/26/bird-7121805__340.jpg,"Bird, Yellow Warbler, Ornithology",3,2,A00000216,Imgs/A00000216.jpg
https://cdn.pixabay.com/photo/2022/04/11/20/01/leopard-7126525__340.jpg,"Leopard, Animal, Mammal, Big Cat",7,0,A00000217,Imgs/A00000217.jpg
https://cdn.pixabay.com/photo/2022/01/28/21/10/honeybee-6975865__340.jpg,"Honeybee, Sunflower, Pollination, Bee",51,11,A00000218,Imgs/A00000218.jpg
https://cdn.pixabay.com/photo/2020/02/08/14/36/trees-4830285__340.jpg,"Trees, Winter, Snow, White, Cold, Nature",442,106,A00000219,Imgs/A00000219.jpg
https://cdn.pixabay.com/photo/2021/10/29/14/27/nature-6752035__480.jpg,High in the French alps. Climbers walk the steep ridge of the valley blanche. The mountains are as dangerous as they are beautiful 👀 Chamonix Mont Blanc,85,16,A00000220,Imgs/A00000220.jpg
https://cdn.pixabay.com/photo/2021/08/15/14/47/couple-6548045__340.jpg,"Couple, Silhouette, Love, Relationship",76,20,A00000221,Imgs/A00000221.jpg
https://cdn.pixabay.com/photo/2021/11/25/09/28/amsterdam-6823002__340.jpg,"Amsterdam, Dam Square, Child, Pigeons",91,19,A00000222,Imgs/A00000222.jpg
https://cdn.pixabay.com/photo/2022/04/09/12/11/duck-7121326__340.jpg,"Duck, Bird, Beak, Feathers, Plumage",7,2,A00000223,Imgs/A00000223.jpg
https://cdn.pixabay.com/photo/2022/04/09/21/11/rice-7122289__340.jpg,"Rice, Tomatoes, Food, Grain, Dish, Table",7,2,A00000224,Imgs/A00000224.jpg
https://cdn.pixabay.com/photo/2021/08/08/15/01/trading-6531134__340.jpg,"Trading, Blockchain, Cryptocurrency",38,7,A00000225,Imgs/A00000225.jpg
https://cdn.pixabay.com/photo/2021/08/14/20/44/stones-6546233__340.jpg,"Stones, Rock, Balance, Balanced Rocks",109,19,A00000226,Imgs/A00000226.jpg
https://cdn.pixabay.com/photo/2021/03/11/02/57/mountain-6086083__340.jpg,"Mountain, Snow, Sunrise, Peak, Summit",286,71,A00000227,Imgs/A00000227.jpg
https://cdn.pixabay.com/photo/2021/08/31/18/51/forest-6589852__340.jpg,"Forest, Nature, Trees, Woods, Outdoors",102,13,A00000228,Imgs/A00000228.jpg
https://cdn.pixabay.com/photo/2022/04/03/14/25/bird-7109091__340.jpg,"Bird, Robin, Ornithology, Species, Fauna",36,27,A00000229,Imgs/A00000229.jpg
https://cdn.pixabay.com/photo/2022/04/08/15/01/mushrooms-7119658__340.jpg,"Mushrooms, Fungi, Mycology, Forest Floor",10,5,A00000230,Imgs/A00000230.jpg
https://cdn.pixabay.com/photo/2022/04/07/10/19/crafting-7117240__340.jpg,"Crafting, Daisies, Vintage Aesthetic",9,3,A00000231,Imgs/A00000231.jpg
https://cdn.pixabay.com/photo/2020/07/27/14/34/forest-5442598__340.jpg,"Forest, Stars, Mountains, Night Sky",411,50,A00000232,Imgs/A00000232.jpg
https://cdn.pixabay.com/photo/2022/01/03/21/08/street-6913633__340.jpg,Sunset Street in Bavarian Alps,35,6,A00000233,Imgs/A00000233.jpg
https://cdn.pixabay.com/photo/2022/04/11/15/32/petals-7126056__480.jpg,"Petals, Tree, Cherry, Garden, Blossom",7,5,A00000234,Imgs/A00000234.jpg
https://cdn.pixabay.com/photo/2016/11/29/13/37/christmas-1869902__340.jpg,"Christmas, Christmas Tree, Presents",1184,292,A00000235,Imgs/A00000235.jpg
https://cdn.pixabay.com/photo/2022/03/27/10/19/squill-7094638__340.jpg,"Squill, Flowers, Plant, Scilla",66,51,A00000236,Imgs/A00000236.jpg
https://cdn.pixabay.com/photo/2022/04/05/15/13/soap-bubbles-7113833__340.jpg,"Soap Bubbles, Colour, Macro, Pattern",21,16,A00000237,Imgs/A00000237.jpg
https://cdn.pixabay.com/photo/2021/07/21/12/22/lavenders-6482952__340.jpg,"Lavenders, Flowers, Lavender Field",158,36,A00000238,Imgs/A00000238.jpg
https://cdn.pixabay.com/photo/2022/04/03/12/45/flowers-7108857__340.jpg,"Flowers, Lucile'S Glory Of The Snow",39,25,A00000239,Imgs/A00000239.jpg
https://cdn.pixabay.com/photo/2021/11/17/17/03/roses-6804169__340.jpg,"Roses, Flowers, Yellow Flowers",96,25,A00000240,Imgs/A00000240.jpg
https://cdn.pixabay.com/photo/2022/02/07/15/22/fuel-6999638__340.jpg,"Fuel, Gas Station, Refueling, Gas",9,3,A00000241,Imgs/A00000241.jpg
https://cdn.pixabay.com/photo/2022/04/09/16/46/peace-7121863__340.jpg,"Peace, Peace Sign, Against War, Ukraine",13,8,A00000242,Imgs/A00000242.jpg
https://cdn.pixabay.com/photo/2022/03/20/10/50/lake-7080525__340.jpg,"Lake, Mountains, Nature, Dusk, To Travel",72,62,A00000243,Imgs/A00000243.jpg
https://cdn.pixabay.com/photo/2022/04/06/08/13/peach-blossom-7115080__340.jpg,"Peach Blossom, Flowers, Branch, Tree",18,18,A00000244,Imgs/A00000244.jpg
https://cdn.pixabay.com/photo/2021/07/29/09/54/honey-bee-6506809__340.jpg,"Honey Bee, Bee, Flowers, Insect, Tansy",106,24,A00000245,Imgs/A00000245.jpg
https://cdn.pixabay.com/photo/2022/04/08/20/38/flower-7120281__340.jpg,"Flower, Anemone, Spring, Blue, Nature",10,4,A00000246,Imgs/A00000246.jpg
https://cdn.pixabay.com/photo/2022/04/09/06/50/magnolia-7120880__340.jpg,"Magnolia, Bud, Flower, Plant, Shrub",8,5,A00000247,Imgs/A00000247.jpg
https://cdn.pixabay.com/photo/2022/04/05/23/11/giant-lily-7114512__340.jpg,Dorianthes Palmeri. 3 meters high. Makes her first flower at 40 years. Blooms only once in her life and dies... ***************************** Dorianthes Palmeri. 3 Meter hoch. Macht ihre erste Blume nach 40 Jahren. Blüht nur einmal in ihrem Leben und stirbt…,29,19,A00000248,Imgs/A00000248.jpg
https://cdn.pixabay.com/photo/2021/07/18/17/11/rufous-6476117__480.jpg,"Rufous, Bird, Hummingbird, Flight, Wings",192,45,A00000249,Imgs/A00000249.jpg
https://cdn.pixabay.com/photo/2021/06/20/08/35/ginkgo-6350293__340.jpg,"Ginkgo, Leaf, Dew, Dewdrops, Raindrops",125,32,A00000250,Imgs/A00000250.jpg
https://cdn.pixabay.com/photo/2022/01/15/15/30/lantern-6939870__340.jpg,"Lantern, Festival, Decoration",35,9,A00000251,Imgs/A00000251.jpg
https://cdn.pixabay.com/photo/2021/11/17/15/07/paris-6803796__340.jpg,"Paris, City, Cloudy Day, Stormy Day",64,20,A00000252,Imgs/A00000252.jpg
https://cdn.pixabay.com/photo/2022/04/09/15/12/animal-7121622__340.jpg,"Animal, Hamadryas Baboon, Baboon",5,1,A00000253,Imgs/A00000253.jpg
https://cdn.pixabay.com/photo/2018/10/01/09/21/pets-3715733__340.jpg,"Pets, Cute, Cat, Dog, Cute Wallpaper",703,182,A00000254,Imgs/A00000254.jpg
https://cdn.pixabay.com/photo/2020/05/25/17/03/travel-5219496__340.jpg,"Travel, Airport, Boarding Pass, Boarding",161,34,A00000255,Imgs/A00000255.jpg
https://cdn.pixabay.com/photo/2022/04/07/21/46/valley-7118324__340.jpg,Portret van de lente,10,6,A00000256,Imgs/A00000256.jpg
https://cdn.pixabay.com/photo/2022/04/06/10/57/ribbon-7115324__340.png,"Ribbon, Bow, Gift, Decoration, Colorful",13,4,A00000257,Imgs/A00000257.jpg
https://cdn.pixabay.com/photo/2022/04/01/07/41/cows-7104262__340.jpg,"Cows, Cattle, Livestock, Farm Animals",47,40,A00000258,Imgs/A00000258.jpg
https://cdn.pixabay.com/photo/2022/04/01/17/02/glory-of-the-snow-7105247__340.jpg,Photographed on 29-03-22 in the Amstelpark.,47,59,A00000259,Imgs/A00000259.jpg
https://cdn.pixabay.com/photo/2022/04/08/06/53/animal-7118858__340.jpg,"Animal, Dog, Canine, Mammal, Breed, Pet",11,7,A00000260,Imgs/A00000260.jpg
https://cdn.pixabay.com/photo/2022/03/09/15/58/tulips-7058127__340.jpg,"Tulips, Flowers, Blossom, Petals, Bloom",107,90,A00000261,Imgs/A00000261.jpg
https://cdn.pixabay.com/photo/2022/04/11/22/08/meadowsweet-7126754__340.jpg,"Meadowsweet, Flowers, Plant",2,0,A00000262,Imgs/A00000262.jpg
https://cdn.pixabay.com/photo/2022/01/20/01/23/floral-background-6951261__480.jpg,"Floral Background, Scrapbooking",80,73,A00000263,Imgs/A00000263.jpg
https://cdn.pixabay.com/photo/2022/04/05/15/08/nature-7113818__340.jpg,"Nature, Sea, Sunset, Water, Mood, Ocean",24,20,A00000264,Imgs/A00000264.jpg
https://cdn.pixabay.com/photo/2022/04/08/15/42/nutrition-7119739__340.jpg,"Nutrition, Market, Corn, Organic, Fresh",11,5,A00000265,Imgs/A00000265.jpg
https://cdn.pixabay.com/photo/2022/03/20/09/38/flower-7080355__340.jpg,"Flower, Humming-Bird, Bird, Orchid",49,37,A00000266,Imgs/A00000266.jpg
https://cdn.pixabay.com/photo/2021/08/23/11/06/nature-6567542__340.jpg,"Nature, Outdoors, Travel, Exploration",78,11,A00000267,Imgs/A00000267.jpg
https://cdn.pixabay.com/photo/2022/04/08/11/39/fire-fighters-7119324__340.jpg,"Fire Fighters, Fire Truck, Fire Fighting",19,11,A00000268,Imgs/A00000268.jpg
https://cdn.pixabay.com/photo/2022/04/07/05/23/orange-flower-7116831__340.jpg,"Orange Flower, Garden, Flower, Nature",12,5,A00000269,Imgs/A00000269.jpg
https://cdn.pixabay.com/photo/2022/04/01/05/52/dog-7104086__340.jpg,Die Badesaison ist eröffnet 😊,39,33,A00000270,Imgs/A00000270.jpg
https://cdn.pixabay.com/photo/2022/03/31/11/07/lion-7102789__340.jpg,"Lion, Animal, Roar, Teeth, Mammal, Cats",24,28,A00000271,Imgs/A00000271.jpg
https://cdn.pixabay.com/photo/2021/11/06/12/27/drops-6773267__340.jpg,"Drops, Water Drops, Trypophobia",84,39,A00000272,Imgs/A00000272.jpg
https://cdn.pixabay.com/photo/2021/11/18/22/17/butterfly-6807529__340.jpg,"Butterfly, Insect, Winged Insect",78,16,A00000273,Imgs/A00000273.jpg
https://cdn.pixabay.com/photo/2021/07/14/12/01/poppies-6465890__340.jpg,"Poppies, Flowers, Buds, Field",141,35,A00000274,Imgs/A00000274.jpg
https://cdn.pixabay.com/photo/2021/11/25/07/18/beach-6822823__340.jpg,"Beach, Ocean, Sea, Spain, Water, Nature",65,6,A00000275,Imgs/A00000275.jpg
https://cdn.pixabay.com/photo/2021/12/17/17/00/butterfly-6876992__340.jpg,"Butterfly, Pollination, Nature, Flower",49,12,A00000276,Imgs/A00000276.jpg
https://cdn.pixabay.com/photo/2022/04/08/17/05/bird-7119927__340.jpg,"Bird, Owl, Ornithology, Species, Fauna",10,4,A00000277,Imgs/A00000277.jpg
https://cdn.pixabay.com/photo/2022/03/30/15/31/mountains-7101380__340.jpg,"Mountains, Hiking, Cave, Stone, Nature",53,41,A00000278,Imgs/A00000278.jpg
https://cdn.pixabay.com/photo/2022/04/04/13/06/young-geese-7111224__480.jpg,"taken on March 29, 2022",21,11,A00000279,Imgs/A00000279.jpg
https://cdn.pixabay.com/photo/2022/04/09/16/45/flowers-7121849__340.jpg,"Flowers, Bee, Pollen, Pollination",5,1,A00000280,Imgs/A00000280.jpg
https://cdn.pixabay.com/photo/2021/09/28/14/21/clocks-6664622__340.jpg,"Clocks, Alarm Clocks, Time",91,20,A00000281,Imgs/A00000281.jpg
https://cdn.pixabay.com/photo/2021/05/29/18/59/petra-6294051__340.jpg,"Petra, Ad Deir, World Heritage",305,158,A00000282,Imgs/A00000282.jpg
https://cdn.pixabay.com/photo/2022/04/04/10/57/australian-wood-ducks-7110894__340.jpg,"Australian Wood Ducks, Ducks, Birds",38,29,A00000283,Imgs/A00000283.jpg
https://cdn.pixabay.com/photo/2022/04/01/19/22/daffodils-7105507__340.jpg,"Daffodils, Easter Eggs, Easter, Flowers",45,32,A00000284,Imgs/A00000284.jpg
https://cdn.pixabay.com/photo/2022/03/29/13/16/great-tit-7099470__340.jpg,"Great Tit, Bird, Perched, Tit, Animal",57,43,A00000285,Imgs/A00000285.jpg
https://cdn.pixabay.com/photo/2022/04/08/14/27/bird-7119597__340.jpg,"Bird, Duckling, Ornithology, Species",10,6,A00000286,Imgs/A00000286.jpg
https://cdn.pixabay.com/photo/2022/04/08/10/28/bird-7119229__340.jpg,"Bird, Pigeon, Ornithology, Species",8,4,A00000287,Imgs/A00000287.jpg
https://cdn.pixabay.com/photo/2022/03/01/18/14/tulip-7041814__340.jpg,"Tulip, Flower, Purple Flower, Dew",89,109,A00000288,Imgs/A00000288.jpg
https://cdn.pixabay.com/photo/2022/04/08/22/55/bird-7120475__340.jpg,"Bird, True Sparrow, Ornithology, Species",4,0,A00000289,Imgs/A00000289.jpg
https://cdn.pixabay.com/photo/2016/03/04/19/36/beach-1236581__340.jpg,"Beach, Sea, Ocean, Tropical",2481,465,A00000290,Imgs/A00000290.jpg
https://cdn.pixabay.com/photo/2020/02/16/20/29/nyc-4854718__340.jpg,"Nyc, New York City, America, Usa, City",248,58,A00000291,Imgs/A00000291.jpg
https://cdn.pixabay.com/photo/2022/04/02/12/38/dandelion-7106936__340.jpg,"Dandelion, Yellow Flower, Wildflower",24,12,A00000292,Imgs/A00000292.jpg
https://cdn.pixabay.com/photo/2022/04/06/14/27/chrysanthemums-7115662__340.jpg,"Chrysanthemums, Flowers, Yellow Flowers",11,10,A00000293,Imgs/A00000293.jpg
https://cdn.pixabay.com/photo/2022/04/05/18/35/easter-7114212__340.jpg,"Easter, Easter Eggs, Easter Nest",22,16,A00000294,Imgs/A00000294.jpg
https://cdn.pixabay.com/photo/2022/04/05/21/19/dog-7114449__340.jpg,"Dog, Eurasier, Canine, Breed, Pet",22,14,A00000295,Imgs/A00000295.jpg
https://cdn.pixabay.com/photo/2022/04/12/00/29/animal-7126909__340.jpg,"Animal, Cat, Chartreux, Breed, Feline",2,0,A00000296,Imgs/A00000296.jpg
https://cdn.pixabay.com/photo/2022/04/06/11/30/girl-7115394__340.jpg,"Girl, Smile, Camera, Photographer",3,2,A00000297,Imgs/A00000297.jpg
https://cdn.pixabay.com/photo/2021/09/28/05/05/bird-6663217__340.jpg,"Bird, Beak, Down, Feathers, Ornithology",135,83,A00000298,Imgs/A00000298.jpg
https://cdn.pixabay.com/photo/2022/04/08/23/47/flower-7120513__340.jpg,"Flower, Zinnia Elegan, Flora, Nature",6,4,A00000299,Imgs/A00000299.jpg
https://cdn.pixabay.com/photo/2022/04/11/15/33/bird-7126057__340.jpg,"Bird, Goose, Egyptian Goose, Meadow",5,3,A00000300,Imgs/A00000300.jpg
https://cdn.pixabay.com/photo/2021/09/17/15/17/fruit-6633086__340.jpg,"Fruit, Grapes, Organic, Healthy, Sweet",74,19,A00000301,Imgs/A00000301.jpg
https://cdn.pixabay.com/photo/2022/04/12/08/32/diva-7127549__340.jpg,"Diva, Drag, Pride, Queen, Beauty",4,0,A00000302,Imgs/A00000302.jpg
https://cdn.pixabay.com/photo/2022/04/11/15/48/ship-7126083__340.jpg,"Ship, Sail, Sea, Training Ship, Ocean",4,2,A00000303,Imgs/A00000303.jpg
https://cdn.pixabay.com/photo/2022/04/09/22/19/buildings-7122332__340.jpg,"Buildings, City, Prague, Roofs, Towers",4,1,A00000304,Imgs/A00000304.jpg
https://cdn.pixabay.com/photo/2022/04/09/15/26/spring-7121653__340.jpg,"Spring, Drove, Nature, Germinate, Growth",7,4,A00000305,Imgs/A00000305.jpg
https://cdn.pixabay.com/photo/2022/04/03/17/48/blackthorn-7109568__340.jpg,"Blackthorn, Blossoms, Bud, Spring, Shrub",27,26,A00000306,Imgs/A00000306.jpg
https://cdn.pixabay.com/photo/2021/12/19/10/26/star-6880592__340.jpg,"Star, Moon, Wise Men, Three Kings",122,86,A00000307,Imgs/A00000307.jpg
https://cdn.pixabay.com/photo/2021/08/02/10/45/cityscape-6516367__340.jpg,"Cityscape, Travel, Tourism, Europe",58,3,A00000308,Imgs/A00000308.jpg
https://cdn.pixabay.com/photo/2022/04/03/13/25/flowers-7108960__340.jpg,"Flowers, Crown Imperial, Bloom, Blossom",34,31,A00000309,Imgs/A00000309.jpg
https://cdn.pixabay.com/photo/2022/03/27/15/37/cherry-blossoms-7095452__480.jpg,"Cherry Blossoms, Pink Flowers",48,38,A00000310,Imgs/A00000310.jpg
https://cdn.pixabay.com/photo/2022/03/26/09/39/sheet-music-7092610__340.jpg,"Sheet Music, Music, Tulips, Flower, Song",25,18,A00000311,Imgs/A00000311.jpg
https://cdn.pixabay.com/photo/2022/04/06/07/50/bird-7115038__340.jpg,"Bird, Ornithology, Species, Fauna, Avian",15,20,A00000312,Imgs/A00000312.jpg
https://cdn.pixabay.com/photo/2022/03/26/02/12/ss-speke-shipwreck-7092132__340.jpg,"The SS Speke was a three masted steel ship built in Wales, 1891. In 1906 she was en route from Peru to Geelong, Australia, to collect a return cargo of wheat when she collided with the reef. This is the remains of her bow or &quot;nose&quot;.",70,72,A00000313,Imgs/A00000313.jpg
https://cdn.pixabay.com/photo/2022/03/17/15/47/flower-7074914__340.jpg,"Flower, Rose, Rose Flower, Cereal",60,70,A00000314,Imgs/A00000314.jpg
https://cdn.pixabay.com/photo/2022/04/03/14/27/throttle-7109099__340.jpg,"Throttle, Bird, Ornithology, Species",27,17,A00000315,Imgs/A00000315.jpg
https://cdn.pixabay.com/photo/2022/04/06/15/33/chihuahua-7115748__340.jpg,"Chihuahua, Long-Haired Chihuahua, Dog",25,19,A00000316,Imgs/A00000316.jpg
https://cdn.pixabay.com/photo/2022/03/23/16/55/sky-7087541__340.jpg,"Sky, Clouds, Cumulus, Airspace, Dusk",50,41,A00000317,Imgs/A00000317.jpg
https://cdn.pixabay.com/photo/2017/02/16/19/47/bokeh-2072271__340.jpg,"Bokeh, Pink, Light, Lights, Colors",1133,243,A00000318,Imgs/A00000318.jpg
https://cdn.pixabay.com/photo/2022/04/07/12/54/fruit-7117438__340.jpg,"Fruit, Lemons, Heart, Food, Kitchen",22,15,A00000319,Imgs/A00000319.jpg
https://cdn.pixabay.com/photo/2022/03/29/11/53/lungwort-7099288__340.jpg,Aufgenommen am 11.3.2022,49,42,A00000320,Imgs/A00000320.jpg
https://cdn.pixabay.com/photo/2022/01/22/16/26/lake-6957802__340.jpg,"Lake, Lighthouse, Pier, Outdoors",56,14,A00000321,Imgs/A00000321.jpg
https://cdn.pixabay.com/photo/2021/07/16/18/28/czech-republic-6471576__340.jpg,"Czech Republic, City, Architecture",80,18,A00000322,Imgs/A00000322.jpg
https://cdn.pixabay.com/photo/2013/11/28/10/36/road-220058__340.jpg,"Road, Pavement, Landscape, Roadway",2872,616,A00000323,Imgs/A00000323.jpg
https://cdn.pixabay.com/photo/2022/04/01/07/41/goose-7104256__340.jpg,"Goose, Waterfowl, Countryside, Rural",42,33,A00000324,Imgs/A00000324.jpg
https://cdn.pixabay.com/photo/2021/08/14/01/58/museum-6544420__340.jpg,"Museum, Pyramid, Facade, Illuminated",62,14,A00000325,Imgs/A00000325.jpg
https://cdn.pixabay.com/photo/2022/04/12/05/25/flowers-7127213__480.jpg,"Flowers, Tulips, Spring, Flora, Garden",1,0,A00000326,Imgs/A00000326.jpg
https://cdn.pixabay.com/photo/2022/04/10/19/34/flower-7124156__340.jpg,"Flower, Dust Trap, Stamen, Macro, Bloom",2,0,A00000327,Imgs/A00000327.jpg
https://cdn.pixabay.com/photo/2021/11/13/18/02/lake-6791971__340.jpg,"Lake, Wetland, Mountains, Landscape",45,13,A00000328,Imgs/A00000328.jpg
https://cdn.pixabay.com/photo/2018/01/24/18/05/background-3104413__340.jpg,"Background, Panorama, Sunset, Dawn, Dusk",1562,335,A00000329,Imgs/A00000329.jpg
https://cdn.pixabay.com/photo/2021/11/08/20/15/elephant-6780085__340.jpg,"Elephant, Skin, Texture, Pachyderm",46,9,A00000330,Imgs/A00000330.jpg
https://cdn.pixabay.com/photo/2022/04/09/20/52/dresden-7122254__340.jpg,"Dresden, Morning, Dawn, Landscape, Birds",6,2,A00000331,Imgs/A00000331.jpg
https://cdn.pixabay.com/photo/2021/08/07/18/36/city-6529108__340.jpg,"City, Architecture, Buildings",78,21,A00000332,Imgs/A00000332.jpg
https://cdn.pixabay.com/photo/2021/10/27/08/43/forest-6746433__340.jpg,"Forest, Foliage, Nature, Shrub, Flora",59,10,A00000333,Imgs/A00000333.jpg
https://cdn.pixabay.com/photo/2022/04/11/02/50/gift-box-7124574__340.jpg,"Gift Box, Gift, Box, Ribbon, Package",2,0,A00000334,Imgs/A00000334.jpg
https://cdn.pixabay.com/photo/2022/04/06/15/29/ranunculus-7115737__340.jpg,"Ranunculus, Flower, Blossom, Bloom",26,19,A00000335,Imgs/A00000335.jpg
https://cdn.pixabay.com/photo/2022/04/09/18/22/cat-7122038__340.jpg,"Cat, Animal, Pet, Kitten, Domestic",2,0,A00000336,Imgs/A00000336.jpg
https://cdn.pixabay.com/photo/2022/03/30/09/14/norway-maple-7100807__340.jpg,Aufgenommen am 25.3.2022,47,28,A00000337,Imgs/A00000337.jpg
