description,views,date,url
A Day in the Life at IIT: Struggles & Successes 🎓 || Meet Apoorva GATE AIR 20,978 views,7 hours ago,https://www.youtube.com/watch?v=Ioj_XA-_jIY
DSA was hard until i learned these 10 Patterns | Master DSA Now,2.8K views,2 days ago,https://www.youtube.com/watch?v=aWjFPloGYmg
You're missing out by not starting the Three 90 Challenge!,217K views,6 days ago,https://www.youtube.com/watch?v=Tcmo0fSCAJQ
Which Programming Language should you learn in 2025 ? | *Free Resources Inside*,1.5K views,7 days ago,https://www.youtube.com/watch?v=qduULN56XGk
Your next 90 Days with Three 90 Challenge! | GeeksforGeeks,36K views,2 weeks ago,https://www.youtube.com/watch?v=SKAfmFZrODc
How to Crack Gate CSE Exam in Just 30 Days ? | Ultimate Roadmap | @geeksforgeeksgatecseandda,1.3K views,2 weeks ago,https://www.youtube.com/watch?v=p-ZRBDab5is
Three 90 Challenge Winners | GeeksforGeeks,510 views,2 weeks ago,https://www.youtube.com/watch?v=-tdb0AghaSU
Three 90 Challenge Winners | GeeksforGeeks,499 views,2 weeks ago,https://www.youtube.com/watch?v=LFxU2PSFMkQ
Three 90 Challenge by GeeksforGeeks | Commonly Asked Questions | FAQs,620 views,2 weeks ago,https://www.youtube.com/watch?v=sb3a4JmUVPc
Three 90 Challenge Winners | GeeksforGeeks,1.1K views,3 weeks ago,https://www.youtube.com/watch?v=rxDSGn5OA7c
Three 90 Challenge Winners | Real Stories | GeeksforGeeks,3.2K views,3 weeks ago,https://www.youtube.com/watch?v=9-EHruhI6g0
Ready to take on the challenge? | 90% Refund Challenge by GeeksforGeeks,192K views,3 weeks ago,https://www.youtube.com/watch?v=B05KjM_OLTA
"I went to the House of a Microsoft Software Engineer | Resume Revealed |SDE Roadmap, Salary, Perks",4.9K views,3 weeks ago,https://www.youtube.com/watch?v=nQ-dpHJPS2c
The Only Cyber Security Roadmap you need for 2025 |,6.8K views,3 weeks ago,https://www.youtube.com/watch?v=0CMNIpd-s_c
GeeksforGeeks is going to rock the world of Education with this move!,1.8K views,4 weeks ago,https://www.youtube.com/watch?v=Na5zVw3g9So
How to get a job in MAANG as a College Student ? | Tips and Hacks | Roadmap,4.9K views,4 weeks ago,https://www.youtube.com/watch?v=dE-MlQnCT78
Get your Dream Internship in the First Year of College | Step by Step Guide,950 views,4 weeks ago,https://www.youtube.com/watch?v=89A8dNvjLYw
GfG Practice Channel Now Home to GfG 160 Challenge New Videos!,764 views,4 weeks ago,https://www.youtube.com/watch?v=_l2tH4saDl4
GfG 160 | Day- 42 | Pair with given sum - 2Sum | 160 Days Daily DSA Problem Solving | GeeksforGeeks,671 views,4 weeks ago,https://www.youtube.com/watch?v=gkps-WFPHYI
These 7 AI Projects will give you an UNFAIR Advantage  | Get Placed,1.2K views,1 month ago,https://www.youtube.com/watch?v=cm1oKGS3mP4
GfG 160 | Day- 41 | Set Matrix Zeroes | 160 Days Daily DSA Problem Solving | GeeksforGeeks,543 views,1 month ago,https://www.youtube.com/watch?v=rOcXfIP3vps
GfG 160 | Day- 40 | Search in a Sorted Matrix | 160 Days Daily DSA Problem Solving | GeeksforGeeks,561 views,1 month ago,https://www.youtube.com/watch?v=maEcp5OXLgg
FREE GATE Test Series 2025 by GeeksforGeeks,2K views,1 month ago,https://www.youtube.com/watch?v=au6Ui7tnPxI
GfG 160 | Day- 39 | Search in a row-wise sorted | 160 Days Daily DSA Problem Solving | GeeksforGeeks,512 views,1 month ago,https://www.youtube.com/watch?v=ln6LYCHeris
GfG 160 | Day- 38 | Search in a Row-wise and Column-wise Sorted | 160 Days Daily DSA Problem Solving,565 views,1 month ago,https://www.youtube.com/watch?v=aZdTzG-OmLU
GfG 160 | Day- 37 | Rotate Matrix | 160 Days Daily DSA Problem Solving | GeeksforGeeks,599 views,1 month ago,https://www.youtube.com/watch?v=RUQF765u8CY
GfG 160 | Day- 36 | Spiral Traversal | 160 Days Daily DSA Problem Solving | GeeksforGeeks,583 views,1 month ago,https://www.youtube.com/watch?v=vI67TeaN6bg
Fastest way to become a AI Engineer in 2025 | *Free Resources Inside*,1.8K views,1 month ago,https://www.youtube.com/watch?v=kAiqXF3TyVg
GfG 160 | Day- 35 | Kth Missing Positive Number | 160 Days Daily DSA Problem Solving | GeeksforGeeks,610 views,1 month ago,https://www.youtube.com/watch?v=Z2UNcqPXOPc
GeeksforGeeks Classes- Now in Hyderabad!,157K views,1 month ago,https://www.youtube.com/watch?v=fvPrYPgDONY
